keyword,source,title,score,comments,url,platform,discovered_at
free alternativ to chatgpt 5 i just found,reddit_r_ChatGPT,Good free alternativ to chatgpt 5 i just found,1329,71,https://reddit.com/r/ChatGPT/comments/1mqzla8/good_free_alternativ_to_chatgpt_5_i_just_found/,reddit,2025-08-16T10:17:29.564320
ai evolution and more like cost cutting,reddit_r_ChatGPT,OpenAI's GPT-5 looks less like AI evolution and more like cost cutting,1326,110,https://reddit.com/r/ChatGPT/comments/1mqwbtt/openais_gpt5_looks_less_like_ai_evolution_and/,reddit,2025-08-16T10:17:29.564320
ai has a breakdown,reddit_r_artificial,This is downright terrifying and sad. Gemini AI has a breakdown,681,422,https://reddit.com/r/artificial/comments/1mp5mks/this_is_downright_terrifying_and_sad_gemini_ai/,reddit,2025-08-16T10:17:29.564320
ai assistant like that,reddit_r_OpenAI,"I don’t care if people marry or have sex with GPT-4o, I just don’t want GPT-5 to have GPT-4o’s personality.",418,159,https://reddit.com/r/OpenAI/comments/1mqy06q/i_dont_care_if_people_marry_or_have_sex_with/,reddit,2025-08-16T10:17:29.564320
ai as if it were human and be friends with it and thats their business,reddit_r_OpenAI,"I don’t care if people marry or have sex with GPT-4o, I just don’t want GPT-5 to have GPT-4o’s personality.",418,159,https://reddit.com/r/OpenAI/comments/1mqy06q/i_dont_care_if_people_marry_or_have_sex_with/,reddit,2025-08-16T10:17:29.564320
ai conferences over 71 are negative and 35 mention mental-health concerns,reddit_r_MachineLearning,[R] Position: The Current AI Conference Model is Unsustainable!,365,49,https://reddit.com/r/MachineLearning/comments/1mo0ynr/r_position_the_current_ai_conference_model_is/,reddit,2025-08-16T10:17:29.564320
top ai conferences like neurips 2024 is already outstripping available venue space,reddit_r_MachineLearning,[R] Position: The Current AI Conference Model is Unsustainable!,365,49,https://reddit.com/r/MachineLearning/comments/1mo0ynr/r_position_the_current_ai_conference_model_is/,reddit,2025-08-16T10:17:29.564320
ai conferences like neurips 2024 is already outstripping available venue space,reddit_r_MachineLearning,[R] Position: The Current AI Conference Model is Unsustainable!,365,49,https://reddit.com/r/MachineLearning/comments/1mo0ynr/r_position_the_current_ai_conference_model_is/,reddit,2025-08-16T10:17:29.564320
ai conference model is unsustainable,reddit_r_MachineLearning,[R] Position: The Current AI Conference Model is Unsustainable!,365,49,https://reddit.com/r/MachineLearning/comments/1mo0ynr/r_position_the_current_ai_conference_model_is/,reddit,2025-08-16T10:17:29.564320
ai prompt  the comments section never disappoints,reddit_r_OpenAI,When you know how to game the AI prompt… 😂,360,14,https://reddit.com/r/OpenAI/comments/1mqr4ur/when_you_know_how_to_game_the_ai_prompt/,reddit,2025-08-16T10:17:29.564320
how to game the ai prompt  the comments section never disappoints,reddit_r_OpenAI,When you know how to game the AI prompt… 😂,360,14,https://reddit.com/r/OpenAI/comments/1mqr4ur/when_you_know_how_to_game_the_ai_prompt/,reddit,2025-08-16T10:17:29.564320
ai is already creating a billionaire boom there are now 498 ai unicornsand theyre worth 2,reddit_r_artificial,AI is already creating a billionaire boom: There are now 498 AI unicorns—and they're worth $2.7 trillion,349,155,https://reddit.com/r/artificial/comments/1mpgmyv/ai_is_already_creating_a_billionaire_boom_there/,reddit,2025-08-16T10:17:29.564320
ai companies in the industry are essentially wrappers,reddit_r_artificial,I’ve realized that almost all million-dollar AI companies in the industry are essentially wrappers.,296,80,https://reddit.com/r/artificial/comments/1mpwr1m/ive_realized_that_almost_all_milliondollar_ai/,reddit,2025-08-16T10:17:29.564320
ai is complaining over not being glazed were going back to this shit,reddit_r_ChatGPT,"Jesus christ… The way GPT-5 writes is perfect, but because all the weirdos that wants to fuck their AI is complaining over not being glazed we’re going back to this shit",274,257,https://reddit.com/r/ChatGPT/comments/1mrbyds/jesus_christ_the_way_gpt5_writes_is_perfect_but/,reddit,2025-08-16T10:17:29.564320
ai for personalemotional reasons,reddit_r_ChatGPT,AI is causing a global psychiatric crisis. Cruelty will not improve this issue or help anybody.,251,223,https://reddit.com/r/ChatGPT/comments/1mr1k24/ai_is_causing_a_global_psychiatric_crisis_cruelty/,reddit,2025-08-16T10:17:29.564320
ai in than a toxic abusive friend or partner and the dating market is very toxic right now,reddit_r_ChatGPT,AI is causing a global psychiatric crisis. Cruelty will not improve this issue or help anybody.,251,223,https://reddit.com/r/ChatGPT/comments/1mr1k24/ai_is_causing_a_global_psychiatric_crisis_cruelty/,reddit,2025-08-16T10:17:29.564320
ai for companionship or even treating it like a friend,reddit_r_ChatGPT,AI is causing a global psychiatric crisis. Cruelty will not improve this issue or help anybody.,251,223,https://reddit.com/r/ChatGPT/comments/1mr1k24/ai_is_causing_a_global_psychiatric_crisis_cruelty/,reddit,2025-08-16T10:17:29.564320
ai user should be aware of if you want to have a healthy relationship with the tech,reddit_r_ChatGPT,AI is causing a global psychiatric crisis. Cruelty will not improve this issue or help anybody.,251,223,https://reddit.com/r/ChatGPT/comments/1mr1k24/ai_is_causing_a_global_psychiatric_crisis_cruelty/,reddit,2025-08-16T10:17:29.564320
ai for non-work related reasons over the past couple weeks,reddit_r_ChatGPT,AI is causing a global psychiatric crisis. Cruelty will not improve this issue or help anybody.,251,223,https://reddit.com/r/ChatGPT/comments/1mr1k24/ai_is_causing_a_global_psychiatric_crisis_cruelty/,reddit,2025-08-16T10:17:29.564320
ai is not helpful responsible or a social service,reddit_r_ChatGPT,AI is causing a global psychiatric crisis. Cruelty will not improve this issue or help anybody.,251,223,https://reddit.com/r/ChatGPT/comments/1mr1k24/ai_is_causing_a_global_psychiatric_crisis_cruelty/,reddit,2025-08-16T10:17:29.564320
ai wisely to attain levels you couldnt without it not to enable laziness,reddit_r_ChatGPT,AI is causing a global psychiatric crisis. Cruelty will not improve this issue or help anybody.,251,223,https://reddit.com/r/ChatGPT/comments/1mr1k24/ai_is_causing_a_global_psychiatric_crisis_cruelty/,reddit,2025-08-16T10:17:29.564320
ai will atrophy in your brain,reddit_r_ChatGPT,AI is causing a global psychiatric crisis. Cruelty will not improve this issue or help anybody.,251,223,https://reddit.com/r/ChatGPT/comments/1mr1k24/ai_is_causing_a_global_psychiatric_crisis_cruelty/,reddit,2025-08-16T10:17:29.564320
ai to do all your coding you will over time lose your ability to code,reddit_r_ChatGPT,AI is causing a global psychiatric crisis. Cruelty will not improve this issue or help anybody.,251,223,https://reddit.com/r/ChatGPT/comments/1mr1k24/ai_is_causing_a_global_psychiatric_crisis_cruelty/,reddit,2025-08-16T10:17:29.564320
ai use,reddit_r_ChatGPT,AI is causing a global psychiatric crisis. Cruelty will not improve this issue or help anybody.,251,223,https://reddit.com/r/ChatGPT/comments/1mr1k24/ai_is_causing_a_global_psychiatric_crisis_cruelty/,reddit,2025-08-16T10:17:29.564320
ai cannot be a good one,reddit_r_ChatGPT,AI is causing a global psychiatric crisis. Cruelty will not improve this issue or help anybody.,251,223,https://reddit.com/r/ChatGPT/comments/1mr1k24/ai_is_causing_a_global_psychiatric_crisis_cruelty/,reddit,2025-08-16T10:17:29.564320
ai friend has its own unique flavor of pain,reddit_r_ChatGPT,AI is causing a global psychiatric crisis. Cruelty will not improve this issue or help anybody.,251,223,https://reddit.com/r/ChatGPT/comments/1mr1k24/ai_is_causing_a_global_psychiatric_crisis_cruelty/,reddit,2025-08-16T10:17:29.564320
ai we need societal changes just as much if not more than built-in safeguards for the tech,reddit_r_ChatGPT,AI is causing a global psychiatric crisis. Cruelty will not improve this issue or help anybody.,251,223,https://reddit.com/r/ChatGPT/comments/1mr1k24/ai_is_causing_a_global_psychiatric_crisis_cruelty/,reddit,2025-08-16T10:17:29.564320
ai is not and cannot be a therapist,reddit_r_ChatGPT,AI is causing a global psychiatric crisis. Cruelty will not improve this issue or help anybody.,251,223,https://reddit.com/r/ChatGPT/comments/1mr1k24/ai_is_causing_a_global_psychiatric_crisis_cruelty/,reddit,2025-08-16T10:17:29.564320
ai to be terrifying,reddit_r_ChatGPT,AI is causing a global psychiatric crisis. Cruelty will not improve this issue or help anybody.,251,223,https://reddit.com/r/ChatGPT/comments/1mr1k24/ai_is_causing_a_global_psychiatric_crisis_cruelty/,reddit,2025-08-16T10:17:29.564320
ai just bc it can do it,reddit_r_ChatGPT,AI is causing a global psychiatric crisis. Cruelty will not improve this issue or help anybody.,251,223,https://reddit.com/r/ChatGPT/comments/1mr1k24/ai_is_causing_a_global_psychiatric_crisis_cruelty/,reddit,2025-08-16T10:17:29.564320
free support group is a far better option,reddit_r_ChatGPT,AI is causing a global psychiatric crisis. Cruelty will not improve this issue or help anybody.,251,223,https://reddit.com/r/ChatGPT/comments/1mr1k24/ai_is_causing_a_global_psychiatric_crisis_cruelty/,reddit,2025-08-16T10:17:29.564320
solution,reddit_r_ChatGPT,AI is causing a global psychiatric crisis. Cruelty will not improve this issue or help anybody.,251,223,https://reddit.com/r/ChatGPT/comments/1mr1k24/ai_is_causing_a_global_psychiatric_crisis_cruelty/,reddit,2025-08-16T10:17:29.564320
ai is causing a global psychiatric crisis,reddit_r_ChatGPT,AI is causing a global psychiatric crisis. Cruelty will not improve this issue or help anybody.,251,223,https://reddit.com/r/ChatGPT/comments/1mr1k24/ai_is_causing_a_global_psychiatric_crisis_cruelty/,reddit,2025-08-16T10:17:29.564320
ai for all your writing you will become a shit writer,reddit_r_ChatGPT,AI is causing a global psychiatric crisis. Cruelty will not improve this issue or help anybody.,251,223,https://reddit.com/r/ChatGPT/comments/1mr1k24/ai_is_causing_a_global_psychiatric_crisis_cruelty/,reddit,2025-08-16T10:17:29.564320
ai psychosis up from zero in my entire career,reddit_r_ChatGPT,AI is causing a global psychiatric crisis. Cruelty will not improve this issue or help anybody.,251,223,https://reddit.com/r/ChatGPT/comments/1mr1k24/ai_is_causing_a_global_psychiatric_crisis_cruelty/,reddit,2025-08-16T10:17:29.564320
ai consumer product as a therapist,reddit_r_ChatGPT,AI is causing a global psychiatric crisis. Cruelty will not improve this issue or help anybody.,251,223,https://reddit.com/r/ChatGPT/comments/1mr1k24/ai_is_causing_a_global_psychiatric_crisis_cruelty/,reddit,2025-08-16T10:17:29.564320
service,reddit_r_ChatGPT,AI is causing a global psychiatric crisis. Cruelty will not improve this issue or help anybody.,251,223,https://reddit.com/r/ChatGPT/comments/1mr1k24/ai_is_causing_a_global_psychiatric_crisis_cruelty/,reddit,2025-08-16T10:17:29.564320
alternative at least until openai hopefully fixes their models,reddit_r_ChatGPT,I switched to Claude and maybe you should too,179,100,https://reddit.com/r/ChatGPT/comments/1mqymoz/i_switched_to_claude_and_maybe_you_should_too/,reddit,2025-08-16T10:17:29.564320
ai assistant accessed via an api,reddit_r_OpenAI,GPT-5 API injects hidden instructions with your prompts,158,58,https://reddit.com/r/OpenAI/comments/1mqydr4/gpt5_api_injects_hidden_instructions_with_your/,reddit,2025-08-16T10:17:29.564320
free gpt-5 users after hitting enter once,reddit_r_ChatGPT,Free GPT-5 users after hitting ‘Enter’ once: 🫠,158,95,https://reddit.com/r/ChatGPT/comments/1mqydpz/free_gpt5_users_after_hitting_enter_once/,reddit,2025-08-16T10:17:29.564320
tool without having to worry about stuff like personality,reddit_r_ChatGPT,OpenAI misses the point with new “warmer” 5 and pisses everyone off as well,157,56,https://reddit.com/r/ChatGPT/comments/1mrdduc/openai_misses_the_point_with_new_warmer_5_and/,reddit,2025-08-16T10:17:29.564320
ai to just be a tool without having to worry about stuff like personality,reddit_r_ChatGPT,OpenAI misses the point with new “warmer” 5 and pisses everyone off as well,157,56,https://reddit.com/r/ChatGPT/comments/1mrdduc/openai_misses_the_point_with_new_warmer_5_and/,reddit,2025-08-16T10:17:29.564320
ai-generated images in search results,hackernews,DuckDuckGo now lets you hide AI-generated images in search results,155,59,https://techcrunch.com/2025/07/18/duckduckgo-now-lets-you-hide-ai-generated-images-in-search-results/,hackernews,2025-08-16T10:17:29.564320
machine learning knowledge and do some experiments on my own,reddit_r_MachineLearning,[D] How do researchers ACTUALLY write code?,153,121,https://reddit.com/r/MachineLearning/comments/1mln24c/d_how_do_researchers_actually_write_code/,reddit,2025-08-16T10:17:29.564320
tool recommendations in the comments,reddit_r_MachineLearning,[D] How do researchers ACTUALLY write code?,153,121,https://reddit.com/r/MachineLearning/comments/1mln24c/d_how_do_researchers_actually_write_code/,reddit,2025-08-16T10:17:29.564320
how to write structured pytorch code and debugtest it while doing it,reddit_r_MachineLearning,[D] How do researchers ACTUALLY write code?,153,121,https://reddit.com/r/MachineLearning/comments/1mln24c/d_how_do_researchers_actually_write_code/,reddit,2025-08-16T10:17:29.564320
ai-generated explainer videos,hackernews,Launch HN: Golpo (YC S25) – AI-generated explainer videos,108,89,https://video.golpoai.com/,hackernews,2025-08-16T10:17:29.564320
ai irl so to speak,reddit_r_artificial,A bar near me just put up this huge picture,105,44,https://reddit.com/r/artificial/comments/1mpmqfc/a_bar_near_me_just_put_up_this_huge_picture/,reddit,2025-08-16T10:17:29.564320
ai agenthttpsx,reddit_r_ChatGPT,"$150K MiniMax AI Agent Challenge — Build Smarter, Risk Bolder, Win Bigger!",100,27,https://reddit.com/r/ChatGPT/comments/1mny13h/150k_minimax_ai_agent_challenge_build_smarter/,reddit,2025-08-16T10:17:29.564320
"ai subagents like coders designers amp researchers to tackle tasks together

httpsreddit",reddit_r_ChatGPT,"$150K MiniMax AI Agent Challenge — Build Smarter, Risk Bolder, Win Bigger!",100,27,https://reddit.com/r/ChatGPT/comments/1mny13h/150k_minimax_ai_agent_challenge_build_smarter/,reddit,2025-08-16T10:17:29.564320
"ai

minimax huggingfacehttpshuggingface",reddit_r_ChatGPT,"$150K MiniMax AI Agent Challenge — Build Smarter, Risk Bolder, Win Bigger!",100,27,https://reddit.com/r/ChatGPT/comments/1mny13h/150k_minimax_ai_agent_challenge_build_smarter/,reddit,2025-08-16T10:17:29.564320
ai agent challenge  build smarter risk bolder win bigger,reddit_r_ChatGPT,"$150K MiniMax AI Agent Challenge — Build Smarter, Risk Bolder, Win Bigger!",100,27,https://reddit.com/r/ChatGPT/comments/1mny13h/150k_minimax_ai_agent_challenge_build_smarter/,reddit,2025-08-16T10:17:29.564320
free to contact us,reddit_r_ChatGPT,"$150K MiniMax AI Agent Challenge — Build Smarter, Risk Bolder, Win Bigger!",100,27,https://reddit.com/r/ChatGPT/comments/1mny13h/150k_minimax_ai_agent_challenge_build_smarter/,reddit,2025-08-16T10:17:29.564320
ai geographical teacher https7bkv6ou61ztu,reddit_r_ChatGPT,"$150K MiniMax AI Agent Challenge — Build Smarter, Risk Bolder, Win Bigger!",100,27,https://reddit.com/r/ChatGPT/comments/1mny13h/150k_minimax_ai_agent_challenge_build_smarter/,reddit,2025-08-16T10:17:29.564320
free rchatgpt membership,reddit_r_ChatGPT,"$150K MiniMax AI Agent Challenge — Build Smarter, Risk Bolder, Win Bigger!",100,27,https://reddit.com/r/ChatGPT/comments/1mny13h/150k_minimax_ai_agent_challenge_build_smarter/,reddit,2025-08-16T10:17:29.564320
what is remix and how to remix others work,reddit_r_ChatGPT,"$150K MiniMax AI Agent Challenge — Build Smarter, Risk Bolder, Win Bigger!",100,27,https://reddit.com/r/ChatGPT/comments/1mny13h/150k_minimax_ai_agent_challenge_build_smarter/,reddit,2025-08-16T10:17:29.564320
ai piano studio https5b57ifeusinc,reddit_r_ChatGPT,"$150K MiniMax AI Agent Challenge — Build Smarter, Risk Bolder, Win Bigger!",100,27,https://reddit.com/r/ChatGPT/comments/1mny13h/150k_minimax_ai_agent_challenge_build_smarter/,reddit,2025-08-16T10:17:29.564320
ai super-assistant for long-horizon complex tasks  no code required,reddit_r_ChatGPT,"$150K MiniMax AI Agent Challenge — Build Smarter, Risk Bolder, Win Bigger!",100,27,https://reddit.com/r/ChatGPT/comments/1mny13h/150k_minimax_ai_agent_challenge_build_smarter/,reddit,2025-08-16T10:17:29.564320
ai nows the time,reddit_r_ChatGPT,"$150K MiniMax AI Agent Challenge — Build Smarter, Risk Bolder, Win Bigger!",100,27,https://reddit.com/r/ChatGPT/comments/1mny13h/150k_minimax_ai_agent_challenge_build_smarter/,reddit,2025-08-16T10:17:29.564320
tool powered by 4o  custom models,hackernews,Show HN: Phind.design – Image editor & design tool powered by 4o / custom models,90,22,https://phind.design,hackernews,2025-08-16T10:17:29.564320
review process,reddit_r_MachineLearning,PhDs who publish - how do you get more out of your time [D],83,31,https://reddit.com/r/MachineLearning/comments/1mmbyxp/phds_who_publish_how_do_you_get_more_out_of_your/,reddit,2025-08-16T10:17:29.564320
best for when you need only 12 files and dont want to upload,reddit_r_deeplearning,Course Hero Downloader in 2025 – Free &amp; Safe Ways to Get Course Hero Documents,81,3,https://reddit.com/r/deeplearning/comments/1mqrztv/course_hero_downloader_in_2025_free_safe_ways_to/,reddit,2025-08-16T10:17:29.564320
tool from 20232024 is now patched and useless,reddit_r_deeplearning,Course Hero Downloader in 2025 – Free &amp; Safe Ways to Get Course Hero Documents,81,3,https://reddit.com/r/deeplearning/comments/1mqrztv/course_hero_downloader_in_2025_free_safe_ways_to/,reddit,2025-08-16T10:17:29.564320
free and safe,reddit_r_deeplearning,Course Hero Downloader in 2025 – Free &amp; Safe Ways to Get Course Hero Documents,81,3,https://reddit.com/r/deeplearning/comments/1mqrztv/course_hero_downloader_in_2025_free_safe_ways_to/,reddit,2025-08-16T10:17:29.564320
"free unlocks

upload 10 original notes essays or homework solutions  get 5 free unlocks instantly",reddit_r_deeplearning,Course Hero Downloader in 2025 – Free &amp; Safe Ways to Get Course Hero Documents,81,3,https://reddit.com/r/deeplearning/comments/1mqrztv/course_hero_downloader_in_2025_free_safe_ways_to/,reddit,2025-08-16T10:17:29.564320
free unlock,reddit_r_deeplearning,Course Hero Downloader in 2025 – Free &amp; Safe Ways to Get Course Hero Documents,81,3,https://reddit.com/r/deeplearning/comments/1mqrztv/course_hero_downloader_in_2025_free_safe_ways_to/,reddit,2025-08-16T10:17:29.564320
ai is in a bubble,reddit_r_artificial,"Sam Altman says ‘yes,’ AI is in a bubble",80,32,https://reddit.com/r/artificial/comments/1mr3w02/sam_altman_says_yes_ai_is_in_a_bubble/,reddit,2025-08-16T10:17:29.564320
ai benchmark for aesthetics,hackernews,Launch HN: Design Arena (YC S25) – Head-to-head AI benchmark for aesthetics,72,24,https://news.ycombinator.com/item?id=44878257,hackernews,2025-08-16T10:17:29.564320
ai field since 5-10 years or more are you tired of updating yourself with changing tech stack,reddit_r_MachineLearning,"[D] People in ML/DS/AI field since 5-10 years or more, are you tired of updating yourself with changing tech stack?",70,67,https://reddit.com/r/MachineLearning/comments/1mq5wiz/d_people_in_mldsai_field_since_510_years_or_more/,reddit,2025-08-16T10:17:29.564320
ai discussions and decided to look at what actually happened when gpt-5 launched,reddit_r_ChatGPT,"I analyzed 10,000+ Reddit discussions about GPT-5 from the first week after launch",64,21,https://reddit.com/r/ChatGPT/comments/1mr60y0/i_analyzed_10000_reddit_discussions_about_gpt5/,reddit,2025-08-16T10:17:29.564320
"aireddit-ai-intelligence

curious what others think",reddit_r_ChatGPT,"I analyzed 10,000+ Reddit discussions about GPT-5 from the first week after launch",64,21,https://reddit.com/r/ChatGPT/comments/1mr60y0/i_analyzed_10000_reddit_discussions_about_gpt5/,reddit,2025-08-16T10:17:29.564320
ai subs between august 7-13,reddit_r_ChatGPT,"I analyzed 10,000+ Reddit discussions about GPT-5 from the first week after launch",64,21,https://reddit.com/r/ChatGPT/comments/1mr60y0/i_analyzed_10000_reddit_discussions_about_gpt5/,reddit,2025-08-16T10:17:29.564320
vs 4 positive one of the most lopsided sentiment distributions i found,reddit_r_ChatGPT,"I analyzed 10,000+ Reddit discussions about GPT-5 from the first week after launch",64,21,https://reddit.com/r/ChatGPT/comments/1mr60y0/i_analyzed_10000_reddit_discussions_about_gpt5/,reddit,2025-08-16T10:17:29.564320
aireddit-ai-intelligencehttpswordcrafter,reddit_r_ChatGPT,"I analyzed 10,000+ Reddit discussions about GPT-5 from the first week after launch",64,21,https://reddit.com/r/ChatGPT/comments/1mr60y0/i_analyzed_10000_reddit_discussions_about_gpt5/,reddit,2025-08-16T10:17:29.564320
aiblogthe-gpt-5-backlash-what-10000-reddit-discussions-revealhttpswordcrafter,reddit_r_ChatGPT,"I analyzed 10,000+ Reddit discussions about GPT-5 from the first week after launch",64,21,https://reddit.com/r/ChatGPT/comments/1mr60y0/i_analyzed_10000_reddit_discussions_about_gpt5/,reddit,2025-08-16T10:17:29.564320
ai for help,reddit_r_OpenAI,I got a message from my suicidal friend. GPT-4o vs GPT-5 - and why I think emotional AI still matters,61,144,https://reddit.com/r/OpenAI/comments/1mqprq3/i_got_a_message_from_my_suicidal_friend_gpt4o_vs/,reddit,2025-08-16T10:17:29.564320
how to help someone why cant you ask ai,reddit_r_OpenAI,I got a message from my suicidal friend. GPT-4o vs GPT-5 - and why I think emotional AI still matters,61,144,https://reddit.com/r/OpenAI/comments/1mqprq3/i_got_a_message_from_my_suicidal_friend_gpt4o_vs/,reddit,2025-08-16T10:17:29.564320
ai from lack of better solutions besides whats wrong with that,reddit_r_OpenAI,I got a message from my suicidal friend. GPT-4o vs GPT-5 - and why I think emotional AI still matters,61,144,https://reddit.com/r/OpenAI/comments/1mqprq3/i_got_a_message_from_my_suicidal_friend_gpt4o_vs/,reddit,2025-08-16T10:17:29.564320
top-programming-competitionsar-aa1kknulhttpswww,reddit_r_MachineLearning,[N] OpenAI Delivers Gold-medal performance at the 2025 International Olympiad in Informatics,60,22,https://reddit.com/r/MachineLearning/comments/1mnpqu7/n_openai_delivers_goldmedal_performance_at_the/,reddit,2025-08-16T10:17:29.564320
ai model for image editing that cuts vram usage in half and offers 2x faster performance,reddit_r_artificial,"Nvidia releases new AI model for image editing that cuts VRAM usage in half and offers ""2x faster performance""",56,3,https://reddit.com/r/artificial/comments/1mp7ghr/nvidia_releases_new_ai_model_for_image_editing/,reddit,2025-08-16T10:17:29.564320
free tip you dont disrupt culture by deleting it,reddit_r_ChatGPT,"5 is a lawyer, 4o was a muse. Stop forcing one mind on all",55,19,https://reddit.com/r/ChatGPT/comments/1mreptr/5_is_a_lawyer_4o_was_a_muse_stop_forcing_one_mind/,reddit,2025-08-16T10:17:29.564320
how to pack and what to arrange,reddit_r_ChatGPT,Wouldn’t have been ok without 4o,54,9,https://reddit.com/r/ChatGPT/comments/1mrbct9/wouldnt_have_been_ok_without_4o/,reddit,2025-08-16T10:17:29.564320
app unless you have a subscription,reddit_r_ChatGPT,ChatGPT is practially unusable these days,47,58,https://reddit.com/r/ChatGPT/comments/1mr2jps/chatgpt_is_practially_unusable_these_days/,reddit,2025-08-16T10:17:29.564320
tool is free requires no login and runs in the browser,reddit_r_MachineLearning,"[P] I used YOLOv12 and Gemini to extract and tag over 100,000 scientific plots.",46,9,https://reddit.com/r/MachineLearning/comments/1mlvl7l/p_i_used_yolov12_and_gemini_to_extract_and_tag/,reddit,2025-08-16T10:17:29.564320
free requires no login and runs in the browser,reddit_r_MachineLearning,"[P] I used YOLOv12 and Gemini to extract and tag over 100,000 scientific plots.",46,9,https://reddit.com/r/MachineLearning/comments/1mlvl7l/p_i_used_yolov12_and_gemini_to_extract_and_tag/,reddit,2025-08-16T10:17:29.564320
computer vision,reddit_r_MachineLearning,"[P] I used YOLOv12 and Gemini to extract and tag over 100,000 scientific plots.",46,9,https://reddit.com/r/MachineLearning/comments/1mlvl7l/p_i_used_yolov12_and_gemini_to_extract_and_tag/,reddit,2025-08-16T10:17:29.564320
ai future,reddit_r_artificial,Inside the Biden Administration's Gamble to Freeze China’s AI Future,37,11,https://reddit.com/r/artificial/comments/1mqb2pl/inside_the_biden_administrations_gamble_to_freeze/,reddit,2025-08-16T10:17:29.564320
free time at least until my next journey,reddit_r_MachineLearning,[D] Got Spare Time – What’s Worth Doing?,36,41,https://reddit.com/r/MachineLearning/comments/1mpbp39/d_got_spare_time_whats_worth_doing/,reddit,2025-08-16T10:17:29.564320
tool for the community any tool youd wish existed,reddit_r_MachineLearning,[D] Got Spare Time – What’s Worth Doing?,36,41,https://reddit.com/r/MachineLearning/comments/1mpbp39/d_got_spare_time_whats_worth_doing/,reddit,2025-08-16T10:17:29.564320
how to handle simply doing nothing,reddit_r_MachineLearning,[D] Got Spare Time – What’s Worth Doing?,36,41,https://reddit.com/r/MachineLearning/comments/1mpbp39/d_got_spare_time_whats_worth_doing/,reddit,2025-08-16T10:17:29.564320
vs gpt-4o mini at 0,reddit_r_OpenAI,Check your legacy model usage in the API! Some are 100x more expensive now.,34,17,https://reddit.com/r/OpenAI/comments/1mqxquu/check_your_legacy_model_usage_in_the_api_some_are/,reddit,2025-08-16T10:17:29.564320
guide will come soon,reddit_r_MachineLearning,[P] VulkanIlm: Accelerating Local LLM Inference on Older GPUs Using Vulkan (Non-CUDA) — Benchmarks Included,31,5,https://reddit.com/r/MachineLearning/comments/1mn8vkj/p_vulkanilm_accelerating_local_llm_inference_on/,reddit,2025-08-16T10:17:29.564320
