keyword,source,title,score,comments,url,platform,discovered_at
ai agents as users,reddit_r_deeplearning,AI Daily News Aug 15 2025: 💊AI designs new antibiotics for superbugs; Google’s new Gemma model is smaller than ever;  Meta AI rules allowed romantic chats with minors;  HTC’s new AI glasses; Google's latest open AI model can run on your smartphone; GPT-5's Medical Reasoning Prowess,1,0,https://reddit.com/r/deeplearning/comments/1mrcp95/ai_daily_news_aug_15_2025_ai_designs_new/,reddit,2025-08-16T10:17:29.564320
ai outputs which included romantic conversations with kids,reddit_r_deeplearning,AI Daily News Aug 15 2025: 💊AI designs new antibiotics for superbugs; Google’s new Gemma model is smaller than ever;  Meta AI rules allowed romantic chats with minors;  HTC’s new AI glasses; Google's latest open AI model can run on your smartphone; GPT-5's Medical Reasoning Prowess,1,0,https://reddit.com/r/deeplearning/comments/1mrcp95/ai_daily_news_aug_15_2025_ai_designs_new/,reddit,2025-08-16T10:17:29.564320
"ai comeback with home robots

httpspreview",reddit_r_deeplearning,"AI Daily News Aug 14 2025: Apple plots AI comeback with home robots; Apple plots expansion into AI robots, home security and smart displays; xAI co-founder leaves to launch AI safety firm; DeepSeek delays new model over Huawei chip failure; OpenAI brings back 4o after GPT-5 anger",1,0,https://reddit.com/r/deeplearning/comments/1mqf71k/ai_daily_news_aug_14_2025_apple_plots_ai_comeback/,reddit,2025-08-16T10:17:29.564320
what is the correct roadmap,reddit_r_deeplearning,Guide Me,1,4,https://reddit.com/r/deeplearning/comments/1mmdidz/guide_me/,reddit,2025-08-16T10:17:29.564320
ai tool to generate and optimize product with targeted keywords,hackernews,Show HN: SEOtip AI tool to generate and optimize product with targeted keywords,1,0,https://seotip.site/,hackernews,2025-08-16T10:17:29.564320
"ai

the lapds interest in geospyhttpslink",reddit_r_deeplearning,"AI Daily News Aug 14 2025: Apple plots AI comeback with home robots; Apple plots expansion into AI robots, home security and smart displays; xAI co-founder leaves to launch AI safety firm; DeepSeek delays new model over Huawei chip failure; OpenAI brings back 4o after GPT-5 anger",1,0,https://reddit.com/r/deeplearning/comments/1mqf71k/ai_daily_news_aug_14_2025_apple_plots_ai_comeback/,reddit,2025-08-16T10:17:29.564320
ai education and traininghttpslink,reddit_r_deeplearning,"AI Daily News Aug 14 2025: Apple plots AI comeback with home robots; Apple plots expansion into AI robots, home security and smart displays; xAI co-founder leaves to launch AI safety firm; DeepSeek delays new model over Huawei chip failure; OpenAI brings back 4o after GPT-5 anger",1,0,https://reddit.com/r/deeplearning/comments/1mqf71k/ai_daily_news_aug_14_2025_apple_plots_ai_comeback/,reddit,2025-08-16T10:17:29.564320
ai startups that  advance humanity and unlock the mysteries of our universe,reddit_r_deeplearning,"AI Daily News Aug 14 2025: Apple plots AI comeback with home robots; Apple plots expansion into AI robots, home security and smart displays; xAI co-founder leaves to launch AI safety firm; DeepSeek delays new model over Huawei chip failure; OpenAI brings back 4o after GPT-5 anger",1,0,https://reddit.com/r/deeplearning/comments/1mqf71k/ai_daily_news_aug_14_2025_apple_plots_ai_comeback/,reddit,2025-08-16T10:17:29.564320
ai talent allow for streamlined offers and higher-up approvals within 24 hours,reddit_r_deeplearning,"AI Daily News Aug 14 2025: Apple plots AI comeback with home robots; Apple plots expansion into AI robots, home security and smart displays; xAI co-founder leaves to launch AI safety firm; DeepSeek delays new model over Huawei chip failure; OpenAI brings back 4o after GPT-5 anger",1,0,https://reddit.com/r/deeplearning/comments/1mqf71k/ai_daily_news_aug_14_2025_apple_plots_ai_comeback/,reddit,2025-08-16T10:17:29.564320
software stacks on unproven domestic hardware,reddit_r_deeplearning,"AI Daily News Aug 14 2025: Apple plots AI comeback with home robots; Apple plots expansion into AI robots, home security and smart displays; xAI co-founder leaves to launch AI safety firm; DeepSeek delays new model over Huawei chip failure; OpenAI brings back 4o after GPT-5 anger",1,0,https://reddit.com/r/deeplearning/comments/1mqf71k/ai_daily_news_aug_14_2025_apple_plots_ai_comeback/,reddit,2025-08-16T10:17:29.564320
ai on august 14th 2025,reddit_r_deeplearning,"AI Daily News Aug 14 2025: Apple plots AI comeback with home robots; Apple plots expansion into AI robots, home security and smart displays; xAI co-founder leaves to launch AI safety firm; DeepSeek delays new model over Huawei chip failure; OpenAI brings back 4o after GPT-5 anger",1,0,https://reddit.com/r/deeplearning/comments/1mqf71k/ai_daily_news_aug_14_2025_apple_plots_ai_comeback/,reddit,2025-08-16T10:17:29.564320
platform,reddit_r_deeplearning,"AI Daily News Aug 14 2025: Apple plots AI comeback with home robots; Apple plots expansion into AI robots, home security and smart displays; xAI co-founder leaves to launch AI safety firm; DeepSeek delays new model over Huawei chip failure; OpenAI brings back 4o after GPT-5 anger",1,0,https://reddit.com/r/deeplearning/comments/1mqf71k/ai_daily_news_aug_14_2025_apple_plots_ai_comeback/,reddit,2025-08-16T10:17:29.564320
ai evaluation and safety platform,reddit_r_deeplearning,"AI Daily News Aug 14 2025: Apple plots AI comeback with home robots; Apple plots expansion into AI robots, home security and smart displays; xAI co-founder leaves to launch AI safety firm; DeepSeek delays new model over Huawei chip failure; OpenAI brings back 4o after GPT-5 anger",1,0,https://reddit.com/r/deeplearning/comments/1mqf71k/ai_daily_news_aug_14_2025_apple_plots_ai_comeback/,reddit,2025-08-16T10:17:29.564320
ai as a potential solution to preventing the tech from wiping out humanity,reddit_r_deeplearning,"AI Daily News Aug 14 2025: Apple plots AI comeback with home robots; Apple plots expansion into AI robots, home security and smart displays; xAI co-founder leaves to launch AI safety firm; DeepSeek delays new model over Huawei chip failure; OpenAI brings back 4o after GPT-5 anger",1,0,https://reddit.com/r/deeplearning/comments/1mqf71k/ai_daily_news_aug_14_2025_apple_plots_ai_comeback/,reddit,2025-08-16T10:17:29.564320
ai research with recruiting led by mustafa suleyman and former meta engineer jay parikh,reddit_r_deeplearning,"AI Daily News Aug 14 2025: Apple plots AI comeback with home robots; Apple plots expansion into AI robots, home security and smart displays; xAI co-founder leaves to launch AI safety firm; DeepSeek delays new model over Huawei chip failure; OpenAI brings back 4o after GPT-5 anger",1,0,https://reddit.com/r/deeplearning/comments/1mqf71k/ai_daily_news_aug_14_2025_apple_plots_ai_comeback/,reddit,2025-08-16T10:17:29.564320
machine learning and deep learning,reddit_r_deeplearning,Guide Me,1,4,https://reddit.com/r/deeplearning/comments/1mmdidz/guide_me/,reddit,2025-08-16T10:17:29.564320
tool which provides 350 searches annually,reddit_r_deeplearning,"AI Daily News Aug 14 2025: Apple plots AI comeback with home robots; Apple plots expansion into AI robots, home security and smart displays; xAI co-founder leaves to launch AI safety firm; DeepSeek delays new model over Huawei chip failure; OpenAI brings back 4o after GPT-5 anger",1,0,https://reddit.com/r/deeplearning/comments/1mqf71k/ai_daily_news_aug_14_2025_apple_plots_ai_comeback/,reddit,2025-08-16T10:17:29.564320
ai-daily-news-aug-14-2025-apple-plots-ai-comeback-withid1684415169,reddit_r_deeplearning,"AI Daily News Aug 14 2025: Apple plots AI comeback with home robots; Apple plots expansion into AI robots, home security and smart displays; xAI co-founder leaves to launch AI safety firm; DeepSeek delays new model over Huawei chip failure; OpenAI brings back 4o after GPT-5 anger",1,0,https://reddit.com/r/deeplearning/comments/1mqf71k/ai_daily_news_aug_14_2025_apple_plots_ai_comeback/,reddit,2025-08-16T10:17:29.564320
ai adoption has reached a fever pitch,reddit_r_deeplearning,"AI Daily News Aug 14 2025: Apple plots AI comeback with home robots; Apple plots expansion into AI robots, home security and smart displays; xAI co-founder leaves to launch AI safety firm; DeepSeek delays new model over Huawei chip failure; OpenAI brings back 4o after GPT-5 anger",1,0,https://reddit.com/r/deeplearning/comments/1mqf71k/ai_daily_news_aug_14_2025_apple_plots_ai_comeback/,reddit,2025-08-16T10:17:29.564320
ai introducedhttpslink,reddit_r_deeplearning,"AI Daily News Aug 14 2025: Apple plots AI comeback with home robots; Apple plots expansion into AI robots, home security and smart displays; xAI co-founder leaves to launch AI safety firm; DeepSeek delays new model over Huawei chip failure; OpenAI brings back 4o after GPT-5 anger",1,0,https://reddit.com/r/deeplearning/comments/1mqf71k/ai_daily_news_aug_14_2025_apple_plots_ai_comeback/,reddit,2025-08-16T10:17:29.564320
ai projects before his recent exit,reddit_r_deeplearning,"AI Daily News Aug 14 2025: Apple plots AI comeback with home robots; Apple plots expansion into AI robots, home security and smart displays; xAI co-founder leaves to launch AI safety firm; DeepSeek delays new model over Huawei chip failure; OpenAI brings back 4o after GPT-5 anger",1,0,https://reddit.com/r/deeplearning/comments/1mqf71k/ai_daily_news_aug_14_2025_apple_plots_ai_comeback/,reddit,2025-08-16T10:17:29.564320
ai launchedhttpslink,reddit_r_deeplearning,"AI Daily News Aug 14 2025: Apple plots AI comeback with home robots; Apple plots expansion into AI robots, home security and smart displays; xAI co-founder leaves to launch AI safety firm; DeepSeek delays new model over Huawei chip failure; OpenAI brings back 4o after GPT-5 anger",1,0,https://reddit.com/r/deeplearning/comments/1mqf71k/ai_daily_news_aug_14_2025_apple_plots_ai_comeback/,reddit,2025-08-16T10:17:29.564320
ai infrastructure spending spree  which weve tracked at around 200 billion this yearhttpslink,reddit_r_deeplearning,"AI Daily News Aug 14 2025: Apple plots AI comeback with home robots; Apple plots expansion into AI robots, home security and smart displays; xAI co-founder leaves to launch AI safety firm; DeepSeek delays new model over Huawei chip failure; OpenAI brings back 4o after GPT-5 anger",1,0,https://reddit.com/r/deeplearning/comments/1mqf71k/ai_daily_news_aug_14_2025_apple_plots_ai_comeback/,reddit,2025-08-16T10:17:29.564320
ai use with a march 2024 policyhttpslink,reddit_r_deeplearning,"AI Daily News Aug 14 2025: Apple plots AI comeback with home robots; Apple plots expansion into AI robots, home security and smart displays; xAI co-founder leaves to launch AI safety firm; DeepSeek delays new model over Huawei chip failure; OpenAI brings back 4o after GPT-5 anger",1,0,https://reddit.com/r/deeplearning/comments/1mqf71k/ai_daily_news_aug_14_2025_apple_plots_ai_comeback/,reddit,2025-08-16T10:17:29.564320
ai chips from nvidia and amd to identify potential reroutings to china,reddit_r_deeplearning,"AI Daily News Aug 14 2025: Apple plots AI comeback with home robots; Apple plots expansion into AI robots, home security and smart displays; xAI co-founder leaves to launch AI safety firm; DeepSeek delays new model over Huawei chip failure; OpenAI brings back 4o after GPT-5 anger",1,0,https://reddit.com/r/deeplearning/comments/1mqf71k/ai_daily_news_aug_14_2025_apple_plots_ai_comeback/,reddit,2025-08-16T10:17:29.564320
ai technologies,reddit_r_deeplearning,"AI Daily News Aug 14 2025: Apple plots AI comeback with home robots; Apple plots expansion into AI robots, home security and smart displays; xAI co-founder leaves to launch AI safety firm; DeepSeek delays new model over Huawei chip failure; OpenAI brings back 4o after GPT-5 anger",1,0,https://reddit.com/r/deeplearning/comments/1mqf71k/ai_daily_news_aug_14_2025_apple_plots_ai_comeback/,reddit,2025-08-16T10:17:29.564320
top of this i wanted to understand if the fact that uniform memory means that all to,reddit_r_deeplearning,Reinforcement Learning Build Strix halo for vs amd 9950 + 5070,1,0,https://reddit.com/r/deeplearning/comments/1mqcfvi/reinforcement_learning_build_strix_halo_for_vs/,reddit,2025-08-16T10:17:29.564320
"guide
now i am confused with the prediction result from the code",reddit_r_deeplearning,Need help with an explanation!!!,1,4,https://reddit.com/r/deeplearning/comments/1mq3s3s/need_help_with_an_explanation/,reddit,2025-08-16T10:17:29.564320
what is the correct one,reddit_r_deeplearning,Need help with an explanation!!!,1,4,https://reddit.com/r/deeplearning/comments/1mq3s3s/need_help_with_an_explanation/,reddit,2025-08-16T10:17:29.564320
deep learning for computer vision,reddit_r_deeplearning,Deep Learning for Computer Vision,1,0,https://reddit.com/r/deeplearning/comments/1movuzp/deep_learning_for_computer_vision/,reddit,2025-08-16T10:17:29.564320
tool to generate and optimize product with targeted keywords,hackernews,Show HN: SEOtip AI tool to generate and optimize product with targeted keywords,1,0,https://seotip.site/,hackernews,2025-08-16T10:17:29.564320
ai talent will be no small feat,reddit_r_deeplearning,"AI Daily News Aug 14 2025: Apple plots AI comeback with home robots; Apple plots expansion into AI robots, home security and smart displays; xAI co-founder leaves to launch AI safety firm; DeepSeek delays new model over Huawei chip failure; OpenAI brings back 4o after GPT-5 anger",1,0,https://reddit.com/r/deeplearning/comments/1mqf71k/ai_daily_news_aug_14_2025_apple_plots_ai_comeback/,reddit,2025-08-16T10:17:29.564320
ai that does cold outreach better than i ever could,hackernews,Show HN: GoAgentic – AI that does cold outreach better than I ever could,1,1,https://news.ycombinator.com/item?id=44818618,hackernews,2025-08-16T10:17:29.564320
tool that writes your resignation letter,hackernews,Show HN: Another GPT wrapper. A boring tool that writes your resignation letter,1,0,https://resignationdesk.com/,hackernews,2025-08-16T10:17:29.564320
compare with the previous price,reddit_r_deeplearning,Suggestions on improving the model for stock prediction LSTM model,1,2,https://reddit.com/r/deeplearning/comments/1mn2fg7/suggestions_on_improving_the_model_for_stock/,reddit,2025-08-16T10:17:29.564320
app store for ai desktop applications,hackernews,Show HN: The App Store for AI Desktop Applications,1,0,https://www.pcagents.store/,hackernews,2025-08-16T10:17:29.564320
ai desktop applications,hackernews,Show HN: The App Store for AI Desktop Applications,1,0,https://www.pcagents.store/,hackernews,2025-08-16T10:17:29.564320
ai allowed,hackernews,World's First Mental Gym – No AI Allowed,1,0,https://news.ycombinator.com/item?id=44769759,hackernews,2025-08-16T10:17:29.564320
ai-powered apps visually no code required,hackernews,"Show HN: Magicnode – Build and share AI-powered apps visually, no code required",1,0,https://magicnode.ai/,hackernews,2025-08-16T10:17:29.564320
ai data tool no coding privacy big data friendly,hackernews,"Local AI Data Tool: No Coding, Privacy, Big Data Friendly",1,0,https://news.ycombinator.com/item?id=44898115,hackernews,2025-08-16T10:17:29.564320
tool no coding privacy big data friendly,hackernews,"Local AI Data Tool: No Coding, Privacy, Big Data Friendly",1,0,https://news.ycombinator.com/item?id=44898115,hackernews,2025-08-16T10:17:29.564320
ai generation,hackernews,Image to Video AI Generation,1,1,https://image-to-video-ai.org,hackernews,2025-08-16T10:17:29.564320
ai image generator guide,youtube_suggestions,YouTube搜索建议: ai image generator guide,0,0,https://www.youtube.com/results?search_query=ai%20image%20generator%20guide,youtube,2025-08-16T10:17:29.564320
best ai writing tools,youtube_suggestions,YouTube搜索建议: best ai writing tools,0,0,https://www.youtube.com/results?search_query=best%20ai%20writing%20tools,youtube,2025-08-16T10:17:29.564320
5 best ai writing tools for fiction,youtube_suggestions,YouTube搜索建议: 5 best ai writing tools for fiction,0,0,https://www.youtube.com/results?search_query=5%20best%20ai%20writing%20tools%20for%20fiction,youtube,2025-08-16T10:17:29.564320
top ai writing tools,youtube_suggestions,YouTube搜索建议: top ai writing tools,0,0,https://www.youtube.com/results?search_query=top%20ai%20writing%20tools,youtube,2025-08-16T10:17:29.564320
rytr ai writing tool review,youtube_suggestions,YouTube搜索建议: rytr ai writing tool review,0,0,https://www.youtube.com/results?search_query=rytr%20ai%20writing%20tool%20review,youtube,2025-08-16T10:17:29.564320
platform called nectar ai,reddit_r_artificial,AI girlfriends are redefining romance. Are we ready for that future?,0,22,https://reddit.com/r/artificial/comments/1mr1r19/ai_girlfriends_are_redefining_romance_are_we/,reddit,2025-08-16T10:17:29.564320
jasper ai writing tool,youtube_suggestions,YouTube搜索建议: jasper ai writing tool,0,0,https://www.youtube.com/results?search_query=jasper%20ai%20writing%20tool,youtube,2025-08-16T10:17:29.564320
lex ai writing tool,youtube_suggestions,YouTube搜索建议: lex ai writing tool,0,0,https://www.youtube.com/results?search_query=lex%20ai%20writing%20tool,youtube,2025-08-16T10:17:29.564320
best ai writing tools in 2024,youtube_suggestions,YouTube搜索建议: best ai writing tools in 2024,0,0,https://www.youtube.com/results?search_query=best%20ai%20writing%20tools%20in%202024,youtube,2025-08-16T10:17:29.564320
ai image generator 日本語,google_suggestions,Google搜索建议: ai image generator 日本語,0,0,https://www.google.com/search?q=ai%20image%20generator%20%E6%97%A5%E6%9C%AC%E8%AA%9E,google,2025-08-16T10:17:29.564320
best ai writing tool 2025,youtube_suggestions,YouTube搜索建议: best ai writing tool 2025,0,0,https://www.youtube.com/results?search_query=best%20ai%20writing%20tool%202025,youtube,2025-08-16T10:17:29.564320
best free ai writing tools,youtube_suggestions,YouTube搜索建议: best free ai writing tools,0,0,https://www.youtube.com/results?search_query=best%20free%20ai%20writing%20tools,youtube,2025-08-16T10:17:29.564320
tool giving them access to more knowledge than ever before,reddit_r_artificial,Do you think AI will make future generations smarter… or more dependent?,0,54,https://reddit.com/r/artificial/comments/1mq3ubx/do_you_think_ai_will_make_future_generations/,reddit,2025-08-16T10:17:29.564320
best ai writing tool,youtube_suggestions,YouTube搜索建议: best ai writing tool,0,0,https://www.youtube.com/results?search_query=best%20ai%20writing%20tool,youtube,2025-08-16T10:17:29.564320
ai writing tools in whatsapp,youtube_suggestions,YouTube搜索建议: ai writing tools in whatsapp,0,0,https://www.youtube.com/results?search_query=ai%20writing%20tools%20in%20whatsapp,youtube,2025-08-16T10:17:29.564320
ai will make future generations smarter or more dependent,reddit_r_artificial,Do you think AI will make future generations smarter… or more dependent?,0,54,https://reddit.com/r/artificial/comments/1mq3ubx/do_you_think_ai_will_make_future_generations/,reddit,2025-08-16T10:17:29.564320
ai image generator 使い方,google_suggestions,Google搜索建议: ai image generator 使い方,0,0,https://www.google.com/search?q=ai%20image%20generator%20%E4%BD%BF%E3%81%84%E6%96%B9,google,2025-08-16T10:17:29.564320
ais role in shaping the minds and habits of the next generation,reddit_r_artificial,Do you think AI will make future generations smarter… or more dependent?,0,54,https://reddit.com/r/artificial/comments/1mq3ubx/do_you_think_ai_will_make_future_generations/,reddit,2025-08-16T10:17:29.564320
ai image generator comparison,youtube_suggestions,YouTube搜索建议: ai image generator comparison,0,0,https://www.youtube.com/results?search_query=ai%20image%20generator%20comparison,youtube,2025-08-16T10:17:29.564320
ai writing tools free online,google_suggestions,Google搜索建议: ai writing tools free online,0,0,https://www.google.com/search?q=ai%20writing%20tools%20free%20online,google,2025-08-16T10:17:29.564320
ai writing tools reddit,google_suggestions,Google搜索建议: ai writing tools reddit,0,0,https://www.google.com/search?q=ai%20writing%20tools%20reddit,google,2025-08-16T10:17:29.564320
ai writing tools apple,google_suggestions,Google搜索建议: ai writing tools apple,0,0,https://www.google.com/search?q=ai%20writing%20tools%20apple,google,2025-08-16T10:17:29.564320
ai writing tools online,google_suggestions,Google搜索建议: ai writing tools online,0,0,https://www.google.com/search?q=ai%20writing%20tools%20online,google,2025-08-16T10:17:29.564320
ai has memories of me,reddit_r_artificial,My AI Has Memories of Me. Should I Be Flattered or Scared?,0,3,https://reddit.com/r/artificial/comments/1mqi2wm/my_ai_has_memories_of_me_should_i_be_flattered_or/,reddit,2025-08-16T10:17:29.564320
ai writing tools for students,google_suggestions,Google搜索建议: ai writing tools for students,0,0,https://www.google.com/search?q=ai%20writing%20tools%20for%20students,google,2025-08-16T10:17:29.564320
ai writing tools for novels,google_suggestions,Google搜索建议: ai writing tools for novels,0,0,https://www.google.com/search?q=ai%20writing%20tools%20for%20novels,google,2025-08-16T10:17:29.564320
ai writing tools like chatgpt,google_suggestions,Google搜索建议: ai writing tools like chatgpt,0,0,https://www.google.com/search?q=ai%20writing%20tools%20like%20chatgpt,google,2025-08-16T10:17:29.564320
ai image generator perchance,google_suggestions,Google搜索建议: ai image generator perchance,0,0,https://www.google.com/search?q=ai%20image%20generator%20perchance,google,2025-08-16T10:17:29.564320
ai image generator 勝手に,google_suggestions,Google搜索建议: ai image generator 勝手に,0,0,https://www.google.com/search?q=ai%20image%20generator%20%E5%8B%9D%E6%89%8B%E3%81%AB,google,2025-08-16T10:17:29.564320
ai image generator online,google_suggestions,Google搜索建议: ai image generator online,0,0,https://www.google.com/search?q=ai%20image%20generator%20online,google,2025-08-16T10:17:29.564320
ai image generator free no login,google_suggestions,Google搜索建议: ai image generator free no login,0,0,https://www.google.com/search?q=ai%20image%20generator%20free%20no%20login,google,2025-08-16T10:17:29.564320
ai image generator anime,google_suggestions,Google搜索建议: ai image generator anime,0,0,https://www.google.com/search?q=ai%20image%20generator%20anime,google,2025-08-16T10:17:29.564320
ai image generator no sign up,google_suggestions,Google搜索建议: ai image generator no sign up,0,0,https://www.google.com/search?q=ai%20image%20generator%20no%20sign%20up,google,2025-08-16T10:17:29.564320
ai image generator from image,google_suggestions,Google搜索建议: ai image generator from image,0,0,https://www.google.com/search?q=ai%20image%20generator%20from%20image,google,2025-08-16T10:17:29.564320
guide us but let us stray,reddit_r_artificial,A Message to the future AI Ruler,0,5,https://reddit.com/r/artificial/comments/1mqnsjm/a_message_to_the_future_ai_ruler/,reddit,2025-08-16T10:17:29.564320
ai writing tools review,youtube_suggestions,YouTube搜索建议: ai writing tools review,0,0,https://www.youtube.com/results?search_query=ai%20writing%20tools%20review,youtube,2025-08-16T10:17:29.564320
ai writing tools free,youtube_suggestions,YouTube搜索建议: ai writing tools free,0,0,https://www.youtube.com/results?search_query=ai%20writing%20tools%20free,youtube,2025-08-16T10:17:29.564320
ai can also build and thats what scares me more than anything else about it,reddit_r_artificial,I need to talk with people who know more...,0,6,https://reddit.com/r/artificial/comments/1mqekd0/i_need_to_talk_with_people_who_know_more/,reddit,2025-08-16T10:17:29.564320
aillms must be generated and shaped now as if they are proto-minds,reddit_r_artificial,The AI Sustainability Wager,0,0,https://reddit.com/r/artificial/comments/1mr4cjn/the_ai_sustainability_wager/,reddit,2025-08-16T10:17:29.564320
how to engage with asi as it will be then,reddit_r_artificial,The AI Sustainability Wager,0,0,https://reddit.com/r/artificial/comments/1mr4cjn/the_ai_sustainability_wager/,reddit,2025-08-16T10:17:29.564320
aillms today sets the preconditions for superalignment when it becomes necessary,reddit_r_artificial,The AI Sustainability Wager,0,0,https://reddit.com/r/artificial/comments/1mr4cjn/the_ai_sustainability_wager/,reddit,2025-08-16T10:17:29.564320
ai 2027 if anyone has read that paper or seen this video,reddit_r_artificial,I need to talk with people who know more...,0,6,https://reddit.com/r/artificial/comments/1mqekd0/i_need_to_talk_with_people_who_know_more/,reddit,2025-08-16T10:17:29.564320
ai development,reddit_r_artificial,I need to talk with people who know more...,0,6,https://reddit.com/r/artificial/comments/1mqekd0/i_need_to_talk_with_people_who_know_more/,reddit,2025-08-16T10:17:29.564320
ai is that a bomb can only destroy,reddit_r_artificial,I need to talk with people who know more...,0,6,https://reddit.com/r/artificial/comments/1mqekd0/i_need_to_talk_with_people_who_know_more/,reddit,2025-08-16T10:17:29.564320
ai era a personal essay addressing some of the well-earned angst this age of ai has fostered,reddit_r_artificial,Searching for Reason in This AI Era,0,6,https://reddit.com/r/artificial/comments/1mqam1x/searching_for_reason_in_this_ai_era/,reddit,2025-08-16T10:17:29.564320
ai super intelligence getting closer every day i really want to say this,reddit_r_artificial,A Message to the future AI Ruler,0,5,https://reddit.com/r/artificial/comments/1mqnsjm/a_message_to_the_future_ai_ruler/,reddit,2025-08-16T10:17:29.564320
aillms as if they already are that gives us the only viable path to sustainable superalignment,reddit_r_artificial,The AI Sustainability Wager,0,0,https://reddit.com/r/artificial/comments/1mr4cjn/the_ai_sustainability_wager/,reddit,2025-08-16T10:17:29.564320
