keyword,source,title,score,comments,url,platform,discovered_at
ai platform and tools for both microsoft and its customers,reddit_r_deeplearning,"AI Daily News Aug 12 2025: GitHub joins Microsoft AI as its CEO steps down, Nvidia’s new AI model helps robots think like humans, China urges firms not to use Nvidia H20, Meta’s AI predicts brain responses to videos, OpenAI's reasoner snags gold at programming olympiad and more",3,0,https://reddit.com/r/deeplearning/comments/1mommm2/ai_daily_news_aug_12_2025_github_joins_microsoft/,reddit,2025-08-16T10:17:29.564320
ai-unraveledid1684415169 20250812httpsfortune,reddit_r_deeplearning,"AI Daily News Aug 12 2025: GitHub joins Microsoft AI as its CEO steps down, Nvidia’s new AI model helps robots think like humans, China urges firms not to use Nvidia H20, Meta’s AI predicts brain responses to videos, OpenAI's reasoner snags gold at programming olympiad and more",3,0,https://reddit.com/r/deeplearning/comments/1mommm2/ai_daily_news_aug_12_2025_github_joins_microsoft/,reddit,2025-08-16T10:17:29.564320
ai lab z ai releasedhttpslink,reddit_r_deeplearning,"AI Daily News Aug 12 2025: GitHub joins Microsoft AI as its CEO steps down, Nvidia’s new AI model helps robots think like humans, China urges firms not to use Nvidia H20, Meta’s AI predicts brain responses to videos, OpenAI's reasoner snags gold at programming olympiad and more",3,0,https://reddit.com/r/deeplearning/comments/1mommm2/ai_daily_news_aug_12_2025_github_joins_microsoft/,reddit,2025-08-16T10:17:29.564320
ai empowermentsuperpowersto blue-collar workers aligning technology with workforce inclusivity,reddit_r_deeplearning,"AI Daily News Aug 12 2025: GitHub joins Microsoft AI as its CEO steps down, Nvidia’s new AI model helps robots think like humans, China urges firms not to use Nvidia H20, Meta’s AI predicts brain responses to videos, OpenAI's reasoner snags gold at programming olympiad and more",3,0,https://reddit.com/r/deeplearning/comments/1mommm2/ai_daily_news_aug_12_2025_github_joins_microsoft/,reddit,2025-08-16T10:17:29.564320
app that helps you write books,hackernews,Show HN: I created an AI writing app that helps you write books,3,0,https://bookswriter.xyz/,hackernews,2025-08-16T10:17:29.564320
ai and othershttpslink,reddit_r_deeplearning,"AI Daily News Aug 12 2025: GitHub joins Microsoft AI as its CEO steps down, Nvidia’s new AI model helps robots think like humans, China urges firms not to use Nvidia H20, Meta’s AI predicts brain responses to videos, OpenAI's reasoner snags gold at programming olympiad and more",3,0,https://reddit.com/r/deeplearning/comments/1mommm2/ai_daily_news_aug_12_2025_github_joins_microsoft/,reddit,2025-08-16T10:17:29.564320
ai systems are ramping up that knowledge,reddit_r_deeplearning,"AI Daily News Aug 12 2025: GitHub joins Microsoft AI as its CEO steps down, Nvidia’s new AI model helps robots think like humans, China urges firms not to use Nvidia H20, Meta’s AI predicts brain responses to videos, OpenAI's reasoner snags gold at programming olympiad and more",3,0,https://reddit.com/r/deeplearning/comments/1mommm2/ai_daily_news_aug_12_2025_github_joins_microsoft/,reddit,2025-08-16T10:17:29.564320
ai overfamiliarity anthropic just handed security teams an easy win,reddit_r_deeplearning,"AI Daily News Aug 12 2025: GitHub joins Microsoft AI as its CEO steps down, Nvidia’s new AI model helps robots think like humans, China urges firms not to use Nvidia H20, Meta’s AI predicts brain responses to videos, OpenAI's reasoner snags gold at programming olympiad and more",3,0,https://reddit.com/r/deeplearning/comments/1mommm2/ai_daily_news_aug_12_2025_github_joins_microsoft/,reddit,2025-08-16T10:17:29.564320
top scores on over 40 different benchmarks,reddit_r_deeplearning,"AI Daily News Aug 12 2025: GitHub joins Microsoft AI as its CEO steps down, Nvidia’s new AI model helps robots think like humans, China urges firms not to use Nvidia H20, Meta’s AI predicts brain responses to videos, OpenAI's reasoner snags gold at programming olympiad and more",3,0,https://reddit.com/r/deeplearning/comments/1mommm2/ai_daily_news_aug_12_2025_github_joins_microsoft/,reddit,2025-08-16T10:17:29.564320
ai code review platform looking for oss beta testers,hackernews,Show HN: Voice-First AI Code Review Platform (Looking for OSS Beta testers),3,0,https://www.lightlayer.dev/,hackernews,2025-08-16T10:17:29.564320
ai tools used by english councils downplay womens health issues study finds,reddit_r_deeplearning,"AI Daily News Aug 12 2025: GitHub joins Microsoft AI as its CEO steps down, Nvidia’s new AI model helps robots think like humans, China urges firms not to use Nvidia H20, Meta’s AI predicts brain responses to videos, OpenAI's reasoner snags gold at programming olympiad and more",3,0,https://reddit.com/r/deeplearning/comments/1mommm2/ai_daily_news_aug_12_2025_github_joins_microsoft/,reddit,2025-08-16T10:17:29.564320
ai acceleration,reddit_r_deeplearning,"AI Daily News Aug 12 2025: GitHub joins Microsoft AI as its CEO steps down, Nvidia’s new AI model helps robots think like humans, China urges firms not to use Nvidia H20, Meta’s AI predicts brain responses to videos, OpenAI's reasoner snags gold at programming olympiad and more",3,0,https://reddit.com/r/deeplearning/comments/1mommm2/ai_daily_news_aug_12_2025_github_joins_microsoft/,reddit,2025-08-16T10:17:29.564320
review platform looking for oss beta testers,hackernews,Show HN: Voice-First AI Code Review Platform (Looking for OSS Beta testers),3,0,https://www.lightlayer.dev/,hackernews,2025-08-16T10:17:29.564320
platform looking for oss beta testers,hackernews,Show HN: Voice-First AI Code Review Platform (Looking for OSS Beta testers),3,0,https://www.lightlayer.dev/,hackernews,2025-08-16T10:17:29.564320
ai in the worlds top pre-college programming competition,reddit_r_deeplearning,"AI Daily News Aug 12 2025: GitHub joins Microsoft AI as its CEO steps down, Nvidia’s new AI model helps robots think like humans, China urges firms not to use Nvidia H20, Meta’s AI predicts brain responses to videos, OpenAI's reasoner snags gold at programming olympiad and more",3,0,https://reddit.com/r/deeplearning/comments/1mommm2/ai_daily_news_aug_12_2025_github_joins_microsoft/,reddit,2025-08-16T10:17:29.564320
ais spatial prediction and safety capabilities,reddit_r_deeplearning,"AI Daily News Aug 12 2025: GitHub joins Microsoft AI as its CEO steps down, Nvidia’s new AI model helps robots think like humans, China urges firms not to use Nvidia H20, Meta’s AI predicts brain responses to videos, OpenAI's reasoner snags gold at programming olympiad and more",3,0,https://reddit.com/r/deeplearning/comments/1mommm2/ai_daily_news_aug_12_2025_github_joins_microsoft/,reddit,2025-08-16T10:17:29.564320
platform for the next wave of robotics development,reddit_r_deeplearning,"AI Daily News Aug 12 2025: GitHub joins Microsoft AI as its CEO steps down, Nvidia’s new AI model helps robots think like humans, China urges firms not to use Nvidia H20, Meta’s AI predicts brain responses to videos, OpenAI's reasoner snags gold at programming olympiad and more",3,0,https://reddit.com/r/deeplearning/comments/1mommm2/ai_daily_news_aug_12_2025_github_joins_microsoft/,reddit,2025-08-16T10:17:29.564320
top pre-college programming competition,reddit_r_deeplearning,"AI Daily News Aug 12 2025: GitHub joins Microsoft AI as its CEO steps down, Nvidia’s new AI model helps robots think like humans, China urges firms not to use Nvidia H20, Meta’s AI predicts brain responses to videos, OpenAI's reasoner snags gold at programming olympiad and more",3,0,https://reddit.com/r/deeplearning/comments/1mommm2/ai_daily_news_aug_12_2025_github_joins_microsoft/,reddit,2025-08-16T10:17:29.564320
tool though only for us users initially,reddit_r_deeplearning,"AI Daily News Aug 12 2025: GitHub joins Microsoft AI as its CEO steps down, Nvidia’s new AI model helps robots think like humans, China urges firms not to use Nvidia H20, Meta’s AI predicts brain responses to videos, OpenAI's reasoner snags gold at programming olympiad and more",3,0,https://reddit.com/r/deeplearning/comments/1mommm2/ai_daily_news_aug_12_2025_github_joins_microsoft/,reddit,2025-08-16T10:17:29.564320
best in brain areas where sight sound and language merge outperforming single-sense models by 30,reddit_r_deeplearning,"AI Daily News Aug 12 2025: GitHub joins Microsoft AI as its CEO steps down, Nvidia’s new AI model helps robots think like humans, China urges firms not to use Nvidia H20, Meta’s AI predicts brain responses to videos, OpenAI's reasoner snags gold at programming olympiad and more",3,0,https://reddit.com/r/deeplearning/comments/1mommm2/ai_daily_news_aug_12_2025_github_joins_microsoft/,reddit,2025-08-16T10:17:29.564320
ai on august 12th 2025,reddit_r_deeplearning,"AI Daily News Aug 12 2025: GitHub joins Microsoft AI as its CEO steps down, Nvidia’s new AI model helps robots think like humans, China urges firms not to use Nvidia H20, Meta’s AI predicts brain responses to videos, OpenAI's reasoner snags gold at programming olympiad and more",3,0,https://reddit.com/r/deeplearning/comments/1mommm2/ai_daily_news_aug_12_2025_github_joins_microsoft/,reddit,2025-08-16T10:17:29.564320
app with the ability to generate hd-quality outputs with lip-sync and audio in six seconds or less,reddit_r_deeplearning,"AI Daily News Aug 12 2025: GitHub joins Microsoft AI as its CEO steps down, Nvidia’s new AI model helps robots think like humans, China urges firms not to use Nvidia H20, Meta’s AI predicts brain responses to videos, OpenAI's reasoner snags gold at programming olympiad and more",3,0,https://reddit.com/r/deeplearning/comments/1mommm2/ai_daily_news_aug_12_2025_github_joins_microsoft/,reddit,2025-08-16T10:17:29.564320
free marking a major shift from the paid-only access since its july launch,reddit_r_deeplearning,"AI Daily News Aug 12 2025: GitHub joins Microsoft AI as its CEO steps down, Nvidia’s new AI model helps robots think like humans, China urges firms not to use Nvidia H20, Meta’s AI predicts brain responses to videos, OpenAI's reasoner snags gold at programming olympiad and more",3,0,https://reddit.com/r/deeplearning/comments/1mommm2/ai_daily_news_aug_12_2025_github_joins_microsoft/,reddit,2025-08-16T10:17:29.564320
ai chess as in ai marketing one bad night can hand your rival a years worth of victory ads,reddit_r_deeplearning,"AI Daily News Aug 12 2025: GitHub joins Microsoft AI as its CEO steps down, Nvidia’s new AI model helps robots think like humans, China urges firms not to use Nvidia H20, Meta’s AI predicts brain responses to videos, OpenAI's reasoner snags gold at programming olympiad and more",3,0,https://reddit.com/r/deeplearning/comments/1mommm2/ai_daily_news_aug_12_2025_github_joins_microsoft/,reddit,2025-08-16T10:17:29.564320
ai it may be entering a danger zone without aggressive investment,reddit_r_deeplearning,"AI Daily News Aug 12 2025: GitHub joins Microsoft AI as its CEO steps down, Nvidia’s new AI model helps robots think like humans, China urges firms not to use Nvidia H20, Meta’s AI predicts brain responses to videos, OpenAI's reasoner snags gold at programming olympiad and more",3,0,https://reddit.com/r/deeplearning/comments/1mommm2/ai_daily_news_aug_12_2025_github_joins_microsoft/,reddit,2025-08-16T10:17:29.564320
platform and tools for both microsoft and its customers,reddit_r_deeplearning,"AI Daily News Aug 12 2025: GitHub joins Microsoft AI as its CEO steps down, Nvidia’s new AI model helps robots think like humans, China urges firms not to use Nvidia H20, Meta’s AI predicts brain responses to videos, OpenAI's reasoner snags gold at programming olympiad and more",3,0,https://reddit.com/r/deeplearning/comments/1mommm2/ai_daily_news_aug_12_2025_github_joins_microsoft/,reddit,2025-08-16T10:17:29.564320
ai tools can polish managers emails but can also erode employee trust,hackernews,Study: AI tools can polish managers' emails but can also erode employee trust,3,0,https://news.ufl.edu/2025/08/writing-ai-work/,hackernews,2025-08-16T10:17:29.564320
ai writing app that helps you write books,hackernews,Show HN: I created an AI writing app that helps you write books,3,0,https://bookswriter.xyz/,hackernews,2025-08-16T10:17:29.564320
ai so it can learn english,hackernews,"Show HN: Help me evolve a new type of AI, so it can learn English",3,0,https://news.ycombinator.com/item?id=44787414,hackernews,2025-08-16T10:17:29.564320
platform with fast cold starts,hackernews,Show HN: We Built a Serverless GPU Platform with Fast Cold Starts,3,5,https://dat1.co,hackernews,2025-08-16T10:17:29.564320
ai image model,hackernews,"Show HN: Qwen-Image, the new SOTA AI image model",3,0,https://wavespeed.ai/models/wavespeed-ai/qwen-image/text-to-image,hackernews,2025-08-16T10:17:29.564320
ai image and video generation using api,hackernews,Show HN: Accelerate AI Image and Video Generation Using API,3,0,https://muapi.ai/,hackernews,2025-08-16T10:17:29.564320
ai imagedeepfake detection that actually works,hackernews,Show HN: Open-source AI image/deepfake detection that actually works,3,0,https://www.nonescape.com/,hackernews,2025-08-16T10:17:29.564320
what is going on like 4o does,reddit_r_OpenAI,It appears OpenAI wants to fix GPT 5 usage statistics at the expense of legacy - ChatPGT 4o weighs in,3,5,https://reddit.com/r/OpenAI/comments/1mrakjf/it_appears_openai_wants_to_fix_gpt_5_usage/,reddit,2025-08-16T10:17:29.564320
free still cant i believe and i see no option to use other models on my chatgpt search extension,reddit_r_OpenAI,It appears OpenAI wants to fix GPT 5 usage statistics at the expense of legacy - ChatPGT 4o weighs in,3,5,https://reddit.com/r/OpenAI/comments/1mrakjf/it_appears_openai_wants_to_fix_gpt_5_usage/,reddit,2025-08-16T10:17:29.564320
best tools,reddit_r_OpenAI,It appears OpenAI wants to fix GPT 5 usage statistics at the expense of legacy - ChatPGT 4o weighs in,3,5,https://reddit.com/r/OpenAI/comments/1mrakjf/it_appears_openai_wants_to_fix_gpt_5_usage/,reddit,2025-08-16T10:17:29.564320
free users,reddit_r_OpenAI,It appears OpenAI wants to fix GPT 5 usage statistics at the expense of legacy - ChatPGT 4o weighs in,3,5,https://reddit.com/r/OpenAI/comments/1mrakjf/it_appears_openai_wants_to_fix_gpt_5_usage/,reddit,2025-08-16T10:17:29.564320
ai cuts llm training data by orders of magnitude,reddit_r_deeplearning,"AI Daily News Aug 12 2025: GitHub joins Microsoft AI as its CEO steps down, Nvidia’s new AI model helps robots think like humans, China urges firms not to use Nvidia H20, Meta’s AI predicts brain responses to videos, OpenAI's reasoner snags gold at programming olympiad and more",3,0,https://reddit.com/r/deeplearning/comments/1mommm2/ai_daily_news_aug_12_2025_github_joins_microsoft/,reddit,2025-08-16T10:17:29.564320
ai-unraveledid1684415169 20250812httpsresearch,reddit_r_deeplearning,"AI Daily News Aug 12 2025: GitHub joins Microsoft AI as its CEO steps down, Nvidia’s new AI model helps robots think like humans, China urges firms not to use Nvidia H20, Meta’s AI predicts brain responses to videos, OpenAI's reasoner snags gold at programming olympiad and more",3,0,https://reddit.com/r/deeplearning/comments/1mommm2/ai_daily_news_aug_12_2025_github_joins_microsoft/,reddit,2025-08-16T10:17:29.564320
ai  use playwright without blowing up your context window,hackernews,Show HN: Browser AI – Use Playwright Without Blowing Up Your Context Window,3,6,https://news.ycombinator.com/item?id=44647393,hackernews,2025-08-16T10:17:29.564320
ai-powered python testing suite that writes its own tests,hackernews,Show HN: I created an AI-powered Python testing suite that writes its own tests,3,0,https://news.ycombinator.com/item?id=44794702,hackernews,2025-08-16T10:17:29.564320
aiml developers,reddit_r_deeplearning,TensorFlow.js Typosquatting Attack: Malicious Package Targeting AI/ML Developers,3,0,https://reddit.com/r/deeplearning/comments/1mojfjv/tensorflowjs_typosquatting_attack_malicious/,reddit,2025-08-16T10:17:29.564320
best chess player laughing at musks flagship model,reddit_r_deeplearning,"AI Daily News Aug 12 2025: GitHub joins Microsoft AI as its CEO steps down, Nvidia’s new AI model helps robots think like humans, China urges firms not to use Nvidia H20, Meta’s AI predicts brain responses to videos, OpenAI's reasoner snags gold at programming olympiad and more",3,0,https://reddit.com/r/deeplearning/comments/1mommm2/ai_daily_news_aug_12_2025_github_joins_microsoft/,reddit,2025-08-16T10:17:29.564320
ai-daily-news-aug-12-2025-github-joins-microsoft-aiid1684415169,reddit_r_deeplearning,"AI Daily News Aug 12 2025: GitHub joins Microsoft AI as its CEO steps down, Nvidia’s new AI model helps robots think like humans, China urges firms not to use Nvidia H20, Meta’s AI predicts brain responses to videos, OpenAI's reasoner snags gold at programming olympiad and more",3,0,https://reddit.com/r/deeplearning/comments/1mommm2/ai_daily_news_aug_12_2025_github_joins_microsoft/,reddit,2025-08-16T10:17:29.564320
"ai predicts brain responses to videos

metas fair team just introducedhttpslink",reddit_r_deeplearning,"AI Daily News Aug 12 2025: GitHub joins Microsoft AI as its CEO steps down, Nvidia’s new AI model helps robots think like humans, China urges firms not to use Nvidia H20, Meta’s AI predicts brain responses to videos, OpenAI's reasoner snags gold at programming olympiad and more",3,0,https://reddit.com/r/deeplearning/comments/1mommm2/ai_daily_news_aug_12_2025_github_joins_microsoft/,reddit,2025-08-16T10:17:29.564320
ai-unraveledid1684415169 20250812httpssiliconangle,reddit_r_deeplearning,"AI Daily News Aug 12 2025: GitHub joins Microsoft AI as its CEO steps down, Nvidia’s new AI model helps robots think like humans, China urges firms not to use Nvidia H20, Meta’s AI predicts brain responses to videos, OpenAI's reasoner snags gold at programming olympiad and more",3,0,https://reddit.com/r/deeplearning/comments/1mommm2/ai_daily_news_aug_12_2025_github_joins_microsoft/,reddit,2025-08-16T10:17:29.564320
ai-unraveledid1684415169 20250812httpsfuture,reddit_r_deeplearning,"AI Daily News Aug 12 2025: GitHub joins Microsoft AI as its CEO steps down, Nvidia’s new AI model helps robots think like humans, China urges firms not to use Nvidia H20, Meta’s AI predicts brain responses to videos, OpenAI's reasoner snags gold at programming olympiad and more",3,0,https://reddit.com/r/deeplearning/comments/1mommm2/ai_daily_news_aug_12_2025_github_joins_microsoft/,reddit,2025-08-16T10:17:29.564320
ai for nonprofits,hackernews,Show HN: Grant Writing AI for Nonprofits,3,1,https://www.grantboost.io/,hackernews,2025-08-16T10:17:29.564320
free access will help expand its user base and gather data for future improvements,reddit_r_deeplearning,"AI Daily News Aug 12 2025: GitHub joins Microsoft AI as its CEO steps down, Nvidia’s new AI model helps robots think like humans, China urges firms not to use Nvidia H20, Meta’s AI predicts brain responses to videos, OpenAI's reasoner snags gold at programming olympiad and more",3,0,https://reddit.com/r/deeplearning/comments/1mommm2/ai_daily_news_aug_12_2025_github_joins_microsoft/,reddit,2025-08-16T10:17:29.564320
ai-unraveledid1684415169 20250812httpswww,reddit_r_deeplearning,"AI Daily News Aug 12 2025: GitHub joins Microsoft AI as its CEO steps down, Nvidia’s new AI model helps robots think like humans, China urges firms not to use Nvidia H20, Meta’s AI predicts brain responses to videos, OpenAI's reasoner snags gold at programming olympiad and more",3,0,https://reddit.com/r/deeplearning/comments/1mommm2/ai_daily_news_aug_12_2025_github_joins_microsoft/,reddit,2025-08-16T10:17:29.564320
free access to grok imaginehttpslink,reddit_r_deeplearning,"AI Daily News Aug 12 2025: GitHub joins Microsoft AI as its CEO steps down, Nvidia’s new AI model helps robots think like humans, China urges firms not to use Nvidia H20, Meta’s AI predicts brain responses to videos, OpenAI's reasoner snags gold at programming olympiad and more",3,0,https://reddit.com/r/deeplearning/comments/1mommm2/ai_daily_news_aug_12_2025_github_joins_microsoft/,reddit,2025-08-16T10:17:29.564320
best approach,reddit_r_MachineLearning,[D] Best way to partition longitudinal data into pre and post time periods for predictive model?,3,7,https://reddit.com/r/MachineLearning/comments/1mq3w9c/d_best_way_to_partition_longitudinal_data_into/,reddit,2025-08-16T10:17:29.564320
deep learning books and courses,reddit_r_deeplearning,Macbook m4 pro - how many params can you train?,3,13,https://reddit.com/r/deeplearning/comments/1mqr0z4/macbook_m4_pro_how_many_params_can_you_train/,reddit,2025-08-16T10:17:29.564320
best way to partition longitudinal data into pre and post time periods for predictive model,reddit_r_MachineLearning,[D] Best way to partition longitudinal data into pre and post time periods for predictive model?,3,7,https://reddit.com/r/MachineLearning/comments/1mq3w9c/d_best_way_to_partition_longitudinal_data_into/,reddit,2025-08-16T10:17:29.564320
review agent for teams,hackernews,Show HN: Open Source AI Code Review Agent for Teams,2,0,https://github.com/wispbit-ai/wispbit,hackernews,2025-08-16T10:17:29.564320
machine learning,reddit_r_artificial,"Is anyone else interested in reading ML research papers, but can't wrap their head around the complexity?",2,13,https://reddit.com/r/artificial/comments/1mqhjj4/is_anyone_else_interested_in_reading_ml_research/,reddit,2025-08-16T10:17:29.564320
ai but the technical jargon and complexity is discouraging,reddit_r_artificial,"Is anyone else interested in reading ML research papers, but can't wrap their head around the complexity?",2,13,https://reddit.com/r/artificial/comments/1mqhjj4/is_anyone_else_interested_in_reading_ml_research/,reddit,2025-08-16T10:17:29.564320
machine learning research papers,reddit_r_artificial,"Is anyone else interested in reading ML research papers, but can't wrap their head around the complexity?",2,13,https://reddit.com/r/artificial/comments/1mqhjj4/is_anyone_else_interested_in_reading_ml_research/,reddit,2025-08-16T10:17:29.564320
ai just add a tars style personality slider,reddit_r_OpenAI,Why doesn’t open ai just add a TARS style personality slider?,2,0,https://reddit.com/r/OpenAI/comments/1mrfgjn/why_doesnt_open_ai_just_add_a_tars_style/,reddit,2025-08-16T10:17:29.564320
ai  create viral youtube thumbnails in seconds with ai,hackernews,Show HN: ThumbFlow AI – Create viral YouTube thumbnails in seconds with AI,2,0,https://thumbflow.io/,hackernews,2025-08-16T10:17:29.564320
ai systems,hackernews,Show HN: KARMA – An evaluation framework for Medical AI systems,2,0,https://karma.eka.care/,hackernews,2025-08-16T10:17:29.564320
ai starter kit  made to reduce noise not add to it,hackernews,"A free AI starter kit – made to reduce noise, not add to it",2,1,https://news.ycombinator.com/item?id=44735679,hackernews,2025-08-16T10:17:29.564320
free ai starter kit  made to reduce noise not add to it,hackernews,"A free AI starter kit – made to reduce noise, not add to it",2,1,https://news.ycombinator.com/item?id=44735679,hackernews,2025-08-16T10:17:29.564320
free beta 10 hours of profiling keysandcaches,reddit_r_deeplearning,New Tool for Finding Why Your ML Inference is Slow,2,0,https://reddit.com/r/deeplearning/comments/1mm0ur3/new_tool_for_finding_why_your_ml_inference_is_slow/,reddit,2025-08-16T10:17:29.564320
ai code review agent for teams,hackernews,Show HN: Open Source AI Code Review Agent for Teams,2,0,https://github.com/wispbit-ai/wispbit,hackernews,2025-08-16T10:17:29.564320
ai-powered trip planner,hackernews,Show HN: AI-Powered Trip Planner,2,0,https://apps.apple.com/us/app/tales-maps-ai-travel-planner/id6746753379,hackernews,2025-08-16T10:17:29.564320
how to manage the cost,reddit_r_deeplearning,How to reduce ai application cost?,2,6,https://reddit.com/r/deeplearning/comments/1mqyrbw/how_to_reduce_ai_application_cost/,reddit,2025-08-16T10:17:29.564320
app as well it would be really helpful if we can connect would be a great learning for me,reddit_r_deeplearning,How to reduce ai application cost?,2,6,https://reddit.com/r/deeplearning/comments/1mqyrbw/how_to_reduce_ai_application_cost/,reddit,2025-08-16T10:17:29.564320
ai application cost,reddit_r_deeplearning,How to reduce ai application cost?,2,6,https://reddit.com/r/deeplearning/comments/1mqyrbw/how_to_reduce_ai_application_cost/,reddit,2025-08-16T10:17:29.564320
how to limit llm calls or in easy words just reduce cost,reddit_r_deeplearning,How to reduce ai application cost?,2,6,https://reddit.com/r/deeplearning/comments/1mqyrbw/how_to_reduce_ai_application_cost/,reddit,2025-08-16T10:17:29.564320
how to reduce ai application cost,reddit_r_deeplearning,How to reduce ai application cost?,2,6,https://reddit.com/r/deeplearning/comments/1mqyrbw/how_to_reduce_ai_application_cost/,reddit,2025-08-16T10:17:29.564320
ai app as well it would be really helpful if we can connect would be a great learning for me,reddit_r_deeplearning,How to reduce ai application cost?,2,6,https://reddit.com/r/deeplearning/comments/1mqyrbw/how_to_reduce_ai_application_cost/,reddit,2025-08-16T10:17:29.564320
open source ai code review agent for teams,hackernews,Show HN: Open Source AI Code Review Agent for Teams,2,0,https://github.com/wispbit-ai/wispbit,hackernews,2025-08-16T10:17:29.564320
ai photo enhancement and virtual staging for real estate,hackernews,Show HN: BrightShot – AI photo enhancement and virtual staging for real estate,2,4,https://bright-shot.com,hackernews,2025-08-16T10:17:29.564320
service and build an aspect graph linking users and items through these aspects,reddit_r_MachineLearning,"[P] Can I use test set reviews to help predict ratings, or is that cheating?",2,2,https://reddit.com/r/MachineLearning/comments/1mqbf3m/p_can_i_use_test_set_reviews_to_help_predict/,reddit,2025-08-16T10:17:29.564320
