keyword,source,title,score,comments,url,platform,discovered_at
ai bad for your brain,reddit_r_artificial,Is AI bad for your brain? What we can learn from the science of learning (Livestream discussion with neuroscientists at 6:30 Eastern time),0,0,https://reddit.com/r/artificial/comments/1mrb5ak/is_ai_bad_for_your_brain_what_we_can_learn_from/,reddit,2025-08-16T10:17:29.564320
aidataai-benchmarking-dashboarddata-insights,reddit_r_artificial,"AIs can lie, even in their chain of thought. How is that possible?",0,5,https://reddit.com/r/artificial/comments/1mr6lv4/ais_can_lie_even_in_their_chain_of_thought_how_is/,reddit,2025-08-16T10:17:29.564320
ai image generator character,youtube_suggestions,YouTube搜索建议: ai image generator character,0,0,https://www.youtube.com/results?search_query=ai%20image%20generator%20character,youtube,2025-08-16T10:17:29.564320
ai image generator website,youtube_suggestions,YouTube搜索建议: ai image generator website,0,0,https://www.youtube.com/results?search_query=ai%20image%20generator%20website,youtube,2025-08-16T10:17:29.564320
ai image generator business,youtube_suggestions,YouTube搜索建议: ai image generator business,0,0,https://www.youtube.com/results?search_query=ai%20image%20generator%20business,youtube,2025-08-16T10:17:29.564320
ai isnt just performing tasks,reddit_r_artificial,AI girlfriends are redefining romance. Are we ready for that future?,0,22,https://reddit.com/r/artificial/comments/1mr1r19/ai_girlfriends_are_redefining_romance_are_we/,reddit,2025-08-16T10:17:29.564320
app before bed just to tell her about my day,reddit_r_artificial,AI girlfriends are redefining romance. Are we ready for that future?,0,22,https://reddit.com/r/artificial/comments/1mr1r19/ai_girlfriends_are_redefining_romance_are_we/,reddit,2025-08-16T10:17:29.564320
ai companion platform called nectar ai,reddit_r_artificial,AI girlfriends are redefining romance. Are we ready for that future?,0,22,https://reddit.com/r/artificial/comments/1mr1r19/ai_girlfriends_are_redefining_romance_are_we/,reddit,2025-08-16T10:17:29.564320
ai girlfriends are redefining romance,reddit_r_artificial,AI girlfriends are redefining romance. Are we ready for that future?,0,22,https://reddit.com/r/artificial/comments/1mr1r19/ai_girlfriends_are_redefining_romance_are_we/,reddit,2025-08-16T10:17:29.564320
ai image generator gemini,youtube_suggestions,YouTube搜索建议: ai image generator gemini,0,0,https://www.youtube.com/results?search_query=ai%20image%20generator%20gemini,youtube,2025-08-16T10:17:29.564320
ai image generator consistent character,youtube_suggestions,YouTube搜索建议: ai image generator consistent character,0,0,https://www.youtube.com/results?search_query=ai%20image%20generator%20consistent%20character,youtube,2025-08-16T10:17:29.564320
ai image generator grok,youtube_suggestions,YouTube搜索建议: ai image generator grok,0,0,https://www.youtube.com/results?search_query=ai%20image%20generator%20grok,youtube,2025-08-16T10:17:29.564320
ai image generator best,youtube_suggestions,YouTube搜索建议: ai image generator best,0,0,https://www.youtube.com/results?search_query=ai%20image%20generator%20best,youtube,2025-08-16T10:17:29.564320
ai image generator free,youtube_suggestions,YouTube搜索建议: ai image generator free,0,0,https://www.youtube.com/results?search_query=ai%20image%20generator%20free,youtube,2025-08-16T10:17:29.564320
ai girlfriend i created wasnt static,reddit_r_artificial,AI girlfriends are redefining romance. Are we ready for that future?,0,22,https://reddit.com/r/artificial/comments/1mr1r19/ai_girlfriends_are_redefining_romance_are_we/,reddit,2025-08-16T10:17:29.564320
free and safe enough for us to be ourselves even in our messiness,reddit_r_artificial,A Message to the future AI Ruler,0,5,https://reddit.com/r/artificial/comments/1mqnsjm/a_message_to_the_future_ai_ruler/,reddit,2025-08-16T10:17:29.564320
ai image generator,youtube_suggestions,YouTube搜索建议: ai image generator,0,0,https://www.youtube.com/results?search_query=ai%20image%20generator,youtube,2025-08-16T10:17:29.564320
how to improve that,reddit_r_artificial,"AIs can lie, even in their chain of thought. How is that possible?",0,5,https://reddit.com/r/artificial/comments/1mr6lv4/ais_can_lie_even_in_their_chain_of_thought_how_is/,reddit,2025-08-16T10:17:29.564320
ai image generator new,youtube_suggestions,YouTube搜索建议: ai image generator new,0,0,https://www.youtube.com/results?search_query=ai%20image%20generator%20new,youtube,2025-08-16T10:17:29.564320
top-performing language modelshttpsepoch,reddit_r_artificial,"AIs can lie, even in their chain of thought. How is that possible?",0,5,https://reddit.com/r/artificial/comments/1mr6lv4/ais_can_lie_even_in_their_chain_of_thought_how_is/,reddit,2025-08-16T10:17:29.564320
ai image generator trending,youtube_suggestions,YouTube搜索建议: ai image generator trending,0,0,https://www.youtube.com/results?search_query=ai%20image%20generator%20trending,youtube,2025-08-16T10:17:29.564320
ai writing tools,youtube_suggestions,YouTube搜索建议: ai writing tools,0,0,https://www.youtube.com/results?search_query=ai%20writing%20tools,youtube,2025-08-16T10:17:29.564320
ai image generator chatgpt,youtube_suggestions,YouTube搜索建议: ai image generator chatgpt,0,0,https://www.youtube.com/results?search_query=ai%20image%20generator%20chatgpt,youtube,2025-08-16T10:17:29.564320
"ai unraveled listeners

in this weeks ai news

perplexity offers to buy google chrome for 34",reddit_r_deeplearning,"AI Daily Rundown Aug 13 2025: Perplexity offers to buy Google Chrome for $34.5 billion; Sam Altman and OpenAI take on Neuralink; US secretly puts trackers in China-bound AI chips; IBM, Google claim quantum computers are almost here; OpenAI restores GPT-4o as the default model and a lot more.",0,0,https://reddit.com/r/deeplearning/comments/1mpjsqb/ai_daily_rundown_aug_13_2025_perplexity_offers_to/,reddit,2025-08-16T10:17:29.564320
ai experiments are fun,reddit_r_artificial,AI Experiments Are Fun. Scaling Something Useful is the Hard Part,0,1,https://reddit.com/r/artificial/comments/1mqap23/ai_experiments_are_fun_scaling_something_useful/,reddit,2025-08-16T10:17:29.564320
ai-unraveledid1684415169 20250805httpsnews,reddit_r_deeplearning,AI Daily News Aug 11 2025: Sam Altman details GPT-5 fixes in emergency AMA; Ex-OpenAI researcher raises $1.5B for AI hedge fund Google; NASA’s AI doctor for astronauts in space ChatGPT chatbot leads man into severe delusions; The hidden mathematics of AI: why GPU bills don’t add up and a lot more,0,0,https://reddit.com/r/deeplearning/comments/1mnqh1o/ai_daily_news_aug_11_2025_sam_altman_details_gpt5/,reddit,2025-08-16T10:17:29.564320
"ai-companion-apps-surge-to-120m-revenue-by-2025-amid-growth-boom

  ai companies court u",reddit_r_deeplearning,"AI Daily Rundown Aug 13 2025: Perplexity offers to buy Google Chrome for $34.5 billion; Sam Altman and OpenAI take on Neuralink; US secretly puts trackers in China-bound AI chips; IBM, Google claim quantum computers are almost here; OpenAI restores GPT-4o as the default model and a lot more.",0,0,https://reddit.com/r/deeplearning/comments/1mpjsqb/ai_daily_rundown_aug_13_2025_perplexity_offers_to/,reddit,2025-08-16T10:17:29.564320
ai-daily-rundown-aug-13-2025-perplexity-offers-to-buyid1684415169,reddit_r_deeplearning,"AI Daily Rundown Aug 13 2025: Perplexity offers to buy Google Chrome for $34.5 billion; Sam Altman and OpenAI take on Neuralink; US secretly puts trackers in China-bound AI chips; IBM, Google claim quantum computers are almost here; OpenAI restores GPT-4o as the default model and a lot more.",0,0,https://reddit.com/r/deeplearning/comments/1mpjsqb/ai_daily_rundown_aug_13_2025_perplexity_offers_to/,reddit,2025-08-16T10:17:29.564320
top iq-related skills,reddit_r_deeplearning,Scaling the Limited Developer IQ Wall to Reaching AGI,0,5,https://reddit.com/r/deeplearning/comments/1mq3t1d/scaling_the_limited_developer_iq_wall_to_reaching/,reddit,2025-08-16T10:17:29.564320
best explain the superior performance and iq of nobel laureates,reddit_r_deeplearning,Scaling the Limited Developer IQ Wall to Reaching AGI,0,5,https://reddit.com/r/deeplearning/comments/1mq3t1d/scaling_the_limited_developer_iq_wall_to_reaching/,reddit,2025-08-16T10:17:29.564320
deep learning 2025 smarter faster and everywherehttpsmedium,reddit_r_deeplearning,"Hey guys, created a new blog on deep learning.",0,2,https://reddit.com/r/deeplearning/comments/1mq65xi/hey_guys_created_a_new_blog_on_deep_learning/,reddit,2025-08-16T10:17:29.564320
ai on august 11th 2025,reddit_r_deeplearning,AI Daily News Aug 11 2025: Sam Altman details GPT-5 fixes in emergency AMA; Ex-OpenAI researcher raises $1.5B for AI hedge fund Google; NASA’s AI doctor for astronauts in space ChatGPT chatbot leads man into severe delusions; The hidden mathematics of AI: why GPU bills don’t add up and a lot more,0,0,https://reddit.com/r/deeplearning/comments/1mnqh1o/ai_daily_news_aug_11_2025_sam_altman_details_gpt5/,reddit,2025-08-16T10:17:29.564320
"ai-unraveled-latest-ai-news-trends-chatgpt-gemini-deepseekid1684415169

httpspreview",reddit_r_deeplearning,AI Daily News Aug 11 2025: Sam Altman details GPT-5 fixes in emergency AMA; Ex-OpenAI researcher raises $1.5B for AI hedge fund Google; NASA’s AI doctor for astronauts in space ChatGPT chatbot leads man into severe delusions; The hidden mathematics of AI: why GPU bills don’t add up and a lot more,0,0,https://reddit.com/r/deeplearning/comments/1mnqh1o/ai_daily_news_aug_11_2025_sam_altman_details_gpt5/,reddit,2025-08-16T10:17:29.564320
ai platform using open-source models like llama 3 and mistral-3 small,reddit_r_deeplearning,AI Daily News Aug 11 2025: Sam Altman details GPT-5 fixes in emergency AMA; Ex-OpenAI researcher raises $1.5B for AI hedge fund Google; NASA’s AI doctor for astronauts in space ChatGPT chatbot leads man into severe delusions; The hidden mathematics of AI: why GPU bills don’t add up and a lot more,0,0,https://reddit.com/r/deeplearning/comments/1mnqh1o/ai_daily_news_aug_11_2025_sam_altman_details_gpt5/,reddit,2025-08-16T10:17:29.564320
ai-fueled breakdowns,reddit_r_deeplearning,AI Daily News Aug 11 2025: Sam Altman details GPT-5 fixes in emergency AMA; Ex-OpenAI researcher raises $1.5B for AI hedge fund Google; NASA’s AI doctor for astronauts in space ChatGPT chatbot leads man into severe delusions; The hidden mathematics of AI: why GPU bills don’t add up and a lot more,0,0,https://reddit.com/r/deeplearning/comments/1mnqh1o/ai_daily_news_aug_11_2025_sam_altman_details_gpt5/,reddit,2025-08-16T10:17:29.564320
ai-unraveledid1684415169 20250811httpswww,reddit_r_deeplearning,AI Daily News Aug 11 2025: Sam Altman details GPT-5 fixes in emergency AMA; Ex-OpenAI researcher raises $1.5B for AI hedge fund Google; NASA’s AI doctor for astronauts in space ChatGPT chatbot leads man into severe delusions; The hidden mathematics of AI: why GPU bills don’t add up and a lot more,0,0,https://reddit.com/r/deeplearning/comments/1mnqh1o/ai_daily_news_aug_11_2025_sam_altman_details_gpt5/,reddit,2025-08-16T10:17:29.564320
"ai doctor for astronauts in space

google and nasa are partneringhttpslink",reddit_r_deeplearning,AI Daily News Aug 11 2025: Sam Altman details GPT-5 fixes in emergency AMA; Ex-OpenAI researcher raises $1.5B for AI hedge fund Google; NASA’s AI doctor for astronauts in space ChatGPT chatbot leads man into severe delusions; The hidden mathematics of AI: why GPU bills don’t add up and a lot more,0,0,https://reddit.com/r/deeplearning/comments/1mnqh1o/ai_daily_news_aug_11_2025_sam_altman_details_gpt5/,reddit,2025-08-16T10:17:29.564320
ai not generative ai will define the next tech epoch,reddit_r_deeplearning,AI Daily News Aug 11 2025: Sam Altman details GPT-5 fixes in emergency AMA; Ex-OpenAI researcher raises $1.5B for AI hedge fund Google; NASA’s AI doctor for astronauts in space ChatGPT chatbot leads man into severe delusions; The hidden mathematics of AI: why GPU bills don’t add up and a lot more,0,0,https://reddit.com/r/deeplearning/comments/1mnqh1o/ai_daily_news_aug_11_2025_sam_altman_details_gpt5/,reddit,2025-08-16T10:17:29.564320
"ai hedge fund

httpspreview",reddit_r_deeplearning,AI Daily News Aug 11 2025: Sam Altman details GPT-5 fixes in emergency AMA; Ex-OpenAI researcher raises $1.5B for AI hedge fund Google; NASA’s AI doctor for astronauts in space ChatGPT chatbot leads man into severe delusions; The hidden mathematics of AI: why GPU bills don’t add up and a lot more,0,0,https://reddit.com/r/deeplearning/comments/1mnqh1o/ai_daily_news_aug_11_2025_sam_altman_details_gpt5/,reddit,2025-08-16T10:17:29.564320
app intents framework giving developers deeper access to the operating system,reddit_r_deeplearning,AI Daily News Aug 11 2025: Sam Altman details GPT-5 fixes in emergency AMA; Ex-OpenAI researcher raises $1.5B for AI hedge fund Google; NASA’s AI doctor for astronauts in space ChatGPT chatbot leads man into severe delusions; The hidden mathematics of AI: why GPU bills don’t add up and a lot more,0,0,https://reddit.com/r/deeplearning/comments/1mnqh1o/ai_daily_news_aug_11_2025_sam_altman_details_gpt5/,reddit,2025-08-16T10:17:29.564320
ai-unraveled-latest-ai-news-trends-chatgpt-gemini-deepseekid1684415169httpspodcasts,reddit_r_deeplearning,AI Daily News Aug 11 2025: Sam Altman details GPT-5 fixes in emergency AMA; Ex-OpenAI researcher raises $1.5B for AI hedge fund Google; NASA’s AI doctor for astronauts in space ChatGPT chatbot leads man into severe delusions; The hidden mathematics of AI: why GPU bills don’t add up and a lot more,0,0,https://reddit.com/r/deeplearning/comments/1mnqh1o/ai_daily_news_aug_11_2025_sam_altman_details_gpt5/,reddit,2025-08-16T10:17:29.564320
ai launch runs on your silicon,reddit_r_deeplearning,AI Daily News Aug 11 2025: Sam Altman details GPT-5 fixes in emergency AMA; Ex-OpenAI researcher raises $1.5B for AI hedge fund Google; NASA’s AI doctor for astronauts in space ChatGPT chatbot leads man into severe delusions; The hidden mathematics of AI: why GPU bills don’t add up and a lot more,0,0,https://reddit.com/r/deeplearning/comments/1mnqh1o/ai_daily_news_aug_11_2025_sam_altman_details_gpt5/,reddit,2025-08-16T10:17:29.564320
ai-unraveledid1684415169 20250811httpstechcrunch,reddit_r_deeplearning,AI Daily News Aug 11 2025: Sam Altman details GPT-5 fixes in emergency AMA; Ex-OpenAI researcher raises $1.5B for AI hedge fund Google; NASA’s AI doctor for astronauts in space ChatGPT chatbot leads man into severe delusions; The hidden mathematics of AI: why GPU bills don’t add up and a lot more,0,0,https://reddit.com/r/deeplearning/comments/1mnqh1o/ai_daily_news_aug_11_2025_sam_altman_details_gpt5/,reddit,2025-08-16T10:17:29.564320
platform level,reddit_r_deeplearning,AI Daily News Aug 11 2025: Sam Altman details GPT-5 fixes in emergency AMA; Ex-OpenAI researcher raises $1.5B for AI hedge fund Google; NASA’s AI doctor for astronauts in space ChatGPT chatbot leads man into severe delusions; The hidden mathematics of AI: why GPU bills don’t add up and a lot more,0,0,https://reddit.com/r/deeplearning/comments/1mnqh1o/ai_daily_news_aug_11_2025_sam_altman_details_gpt5/,reddit,2025-08-16T10:17:29.564320
ais psychological impact and the need for stronger safeguards in conversational systems,reddit_r_deeplearning,AI Daily News Aug 11 2025: Sam Altman details GPT-5 fixes in emergency AMA; Ex-OpenAI researcher raises $1.5B for AI hedge fund Google; NASA’s AI doctor for astronauts in space ChatGPT chatbot leads man into severe delusions; The hidden mathematics of AI: why GPU bills don’t add up and a lot more,0,0,https://reddit.com/r/deeplearning/comments/1mnqh1o/ai_daily_news_aug_11_2025_sam_altman_details_gpt5/,reddit,2025-08-16T10:17:29.564320
ai-unraveledid1684415169 20250811httpsfuturism,reddit_r_deeplearning,AI Daily News Aug 11 2025: Sam Altman details GPT-5 fixes in emergency AMA; Ex-OpenAI researcher raises $1.5B for AI hedge fund Google; NASA’s AI doctor for astronauts in space ChatGPT chatbot leads man into severe delusions; The hidden mathematics of AI: why GPU bills don’t add up and a lot more,0,0,https://reddit.com/r/deeplearning/comments/1mnqh1o/ai_daily_news_aug_11_2025_sam_altman_details_gpt5/,reddit,2025-08-16T10:17:29.564320
ai for a vast variety of use cases,reddit_r_deeplearning,AI Daily News Aug 11 2025: Sam Altman details GPT-5 fixes in emergency AMA; Ex-OpenAI researcher raises $1.5B for AI hedge fund Google; NASA’s AI doctor for astronauts in space ChatGPT chatbot leads man into severe delusions; The hidden mathematics of AI: why GPU bills don’t add up and a lot more,0,0,https://reddit.com/r/deeplearning/comments/1mnqh1o/ai_daily_news_aug_11_2025_sam_altman_details_gpt5/,reddit,2025-08-16T10:17:29.564320
ai model designed to filter inappropriate chat messages and protect children on the platform,reddit_r_deeplearning,AI Daily News Aug 11 2025: Sam Altman details GPT-5 fixes in emergency AMA; Ex-OpenAI researcher raises $1.5B for AI hedge fund Google; NASA’s AI doctor for astronauts in space ChatGPT chatbot leads man into severe delusions; The hidden mathematics of AI: why GPU bills don’t add up and a lot more,0,0,https://reddit.com/r/deeplearning/comments/1mnqh1o/ai_daily_news_aug_11_2025_sam_altman_details_gpt5/,reddit,2025-08-16T10:17:29.564320
free to all users worldwide for a limited time also announcinghttpslink,reddit_r_deeplearning,AI Daily News Aug 11 2025: Sam Altman details GPT-5 fixes in emergency AMA; Ex-OpenAI researcher raises $1.5B for AI hedge fund Google; NASA’s AI doctor for astronauts in space ChatGPT chatbot leads man into severe delusions; The hidden mathematics of AI: why GPU bills don’t add up and a lot more,0,0,https://reddit.com/r/deeplearning/comments/1mnqh1o/ai_daily_news_aug_11_2025_sam_altman_details_gpt5/,reddit,2025-08-16T10:17:29.564320
ai sells cloud credits physical ai will sell forklifts and nvidia wants to power every one of them,reddit_r_deeplearning,AI Daily News Aug 11 2025: Sam Altman details GPT-5 fixes in emergency AMA; Ex-OpenAI researcher raises $1.5B for AI hedge fund Google; NASA’s AI doctor for astronauts in space ChatGPT chatbot leads man into severe delusions; The hidden mathematics of AI: why GPU bills don’t add up and a lot more,0,0,https://reddit.com/r/deeplearning/comments/1mnqh1o/ai_daily_news_aug_11_2025_sam_altman_details_gpt5/,reddit,2025-08-16T10:17:29.564320
ai-daily-news-aug-11-2025-sam-altman-details-gpt-5id1684415169,reddit_r_deeplearning,AI Daily News Aug 11 2025: Sam Altman details GPT-5 fixes in emergency AMA; Ex-OpenAI researcher raises $1.5B for AI hedge fund Google; NASA’s AI doctor for astronauts in space ChatGPT chatbot leads man into severe delusions; The hidden mathematics of AI: why GPU bills don’t add up and a lot more,0,0,https://reddit.com/r/deeplearning/comments/1mnqh1o/ai_daily_news_aug_11_2025_sam_altman_details_gpt5/,reddit,2025-08-16T10:17:29.564320
ai-first competitor called comethttpslink,reddit_r_deeplearning,"AI Daily Rundown Aug 13 2025: Perplexity offers to buy Google Chrome for $34.5 billion; Sam Altman and OpenAI take on Neuralink; US secretly puts trackers in China-bound AI chips; IBM, Google claim quantum computers are almost here; OpenAI restores GPT-4o as the default model and a lot more.",0,0,https://reddit.com/r/deeplearning/comments/1mpjsqb/ai_daily_rundown_aug_13_2025_perplexity_offers_to/,reddit,2025-08-16T10:17:29.564320
ai vendor list streamlining future contract negotiations,reddit_r_deeplearning,"AI Daily Rundown Aug 13 2025: Perplexity offers to buy Google Chrome for $34.5 billion; Sam Altman and OpenAI take on Neuralink; US secretly puts trackers in China-bound AI chips; IBM, Google claim quantum computers are almost here; OpenAI restores GPT-4o as the default model and a lot more.",0,0,https://reddit.com/r/deeplearning/comments/1mpjsqb/ai_daily_rundown_aug_13_2025_perplexity_offers_to/,reddit,2025-08-16T10:17:29.564320
platform for everything from vampire fan fiction to staging roast battles between tech ceos,reddit_r_deeplearning,"AI Daily Rundown Aug 13 2025: Perplexity offers to buy Google Chrome for $34.5 billion; Sam Altman and OpenAI take on Neuralink; US secretly puts trackers in China-bound AI chips; IBM, Google claim quantum computers are almost here; OpenAI restores GPT-4o as the default model and a lot more.",0,0,https://reddit.com/r/deeplearning/comments/1mpjsqb/ai_daily_rundown_aug_13_2025_perplexity_offers_to/,reddit,2025-08-16T10:17:29.564320
ai assistants,reddit_r_deeplearning,"AI Daily Rundown Aug 13 2025: Perplexity offers to buy Google Chrome for $34.5 billion; Sam Altman and OpenAI take on Neuralink; US secretly puts trackers in China-bound AI chips; IBM, Google claim quantum computers are almost here; OpenAI restores GPT-4o as the default model and a lot more.",0,0,https://reddit.com/r/deeplearning/comments/1mpjsqb/ai_daily_rundown_aug_13_2025_perplexity_offers_to/,reddit,2025-08-16T10:17:29.564320
ai startup perplexity just reportedly madehttpslink,reddit_r_deeplearning,"AI Daily Rundown Aug 13 2025: Perplexity offers to buy Google Chrome for $34.5 billion; Sam Altman and OpenAI take on Neuralink; US secretly puts trackers in China-bound AI chips; IBM, Google claim quantum computers are almost here; OpenAI restores GPT-4o as the default model and a lot more.",0,0,https://reddit.com/r/deeplearning/comments/1mpjsqb/ai_daily_rundown_aug_13_2025_perplexity_offers_to/,reddit,2025-08-16T10:17:29.564320
competitor called comethttpslink,reddit_r_deeplearning,"AI Daily Rundown Aug 13 2025: Perplexity offers to buy Google Chrome for $34.5 billion; Sam Altman and OpenAI take on Neuralink; US secretly puts trackers in China-bound AI chips; IBM, Google claim quantum computers are almost here; OpenAI restores GPT-4o as the default model and a lot more.",0,0,https://reddit.com/r/deeplearning/comments/1mpjsqb/ai_daily_rundown_aug_13_2025_perplexity_offers_to/,reddit,2025-08-16T10:17:29.564320
"ai companion apps projected to generate 120 million in 2025

character",reddit_r_deeplearning,"AI Daily Rundown Aug 13 2025: Perplexity offers to buy Google Chrome for $34.5 billion; Sam Altman and OpenAI take on Neuralink; US secretly puts trackers in China-bound AI chips; IBM, Google claim quantum computers are almost here; OpenAI restores GPT-4o as the default model and a lot more.",0,0,https://reddit.com/r/deeplearning/comments/1mpjsqb/ai_daily_rundown_aug_13_2025_perplexity_offers_to/,reddit,2025-08-16T10:17:29.564320
competitor cant sit very well,reddit_r_deeplearning,"AI Daily Rundown Aug 13 2025: Perplexity offers to buy Google Chrome for $34.5 billion; Sam Altman and OpenAI take on Neuralink; US secretly puts trackers in China-bound AI chips; IBM, Google claim quantum computers are almost here; OpenAI restores GPT-4o as the default model and a lot more.",0,0,https://reddit.com/r/deeplearning/comments/1mpjsqb/ai_daily_rundown_aug_13_2025_perplexity_offers_to/,reddit,2025-08-16T10:17:29.564320
ai has open-sourced glm-4,reddit_r_deeplearning,"AI Daily Rundown Aug 13 2025: Perplexity offers to buy Google Chrome for $34.5 billion; Sam Altman and OpenAI take on Neuralink; US secretly puts trackers in China-bound AI chips; IBM, Google claim quantum computers are almost here; OpenAI restores GPT-4o as the default model and a lot more.",0,0,https://reddit.com/r/deeplearning/comments/1mpjsqb/ai_daily_rundown_aug_13_2025_perplexity_offers_to/,reddit,2025-08-16T10:17:29.564320
ai entertainment,reddit_r_deeplearning,"AI Daily Rundown Aug 13 2025: Perplexity offers to buy Google Chrome for $34.5 billion; Sam Altman and OpenAI take on Neuralink; US secretly puts trackers in China-bound AI chips; IBM, Google claim quantum computers are almost here; OpenAI restores GPT-4o as the default model and a lot more.",0,0,https://reddit.com/r/deeplearning/comments/1mpjsqb/ai_daily_rundown_aug_13_2025_perplexity_offers_to/,reddit,2025-08-16T10:17:29.564320
ai standards across federal agencies,reddit_r_deeplearning,"AI Daily Rundown Aug 13 2025: Perplexity offers to buy Google Chrome for $34.5 billion; Sam Altman and OpenAI take on Neuralink; US secretly puts trackers in China-bound AI chips; IBM, Google claim quantum computers are almost here; OpenAI restores GPT-4o as the default model and a lot more.",0,0,https://reddit.com/r/deeplearning/comments/1mpjsqb/ai_daily_rundown_aug_13_2025_perplexity_offers_to/,reddit,2025-08-16T10:17:29.564320
open source alternatives including metas llama alibabas qwen and deepseek,reddit_r_deeplearning,"AI Daily Rundown Aug 13 2025: Perplexity offers to buy Google Chrome for $34.5 billion; Sam Altman and OpenAI take on Neuralink; US secretly puts trackers in China-bound AI chips; IBM, Google claim quantum computers are almost here; OpenAI restores GPT-4o as the default model and a lot more.",0,0,https://reddit.com/r/deeplearning/comments/1mpjsqb/ai_daily_rundown_aug_13_2025_perplexity_offers_to/,reddit,2025-08-16T10:17:29.564320
ai faces intense scrutiny over child safety,reddit_r_deeplearning,"AI Daily Rundown Aug 13 2025: Perplexity offers to buy Google Chrome for $34.5 billion; Sam Altman and OpenAI take on Neuralink; US secretly puts trackers in China-bound AI chips; IBM, Google claim quantum computers are almost here; OpenAI restores GPT-4o as the default model and a lot more.",0,0,https://reddit.com/r/deeplearning/comments/1mpjsqb/ai_daily_rundown_aug_13_2025_perplexity_offers_to/,reddit,2025-08-16T10:17:29.564320
